label,message
ham,well im computerless time make oreo truffle
ham,somewhere beneath pale moon light someone think u dream come true goodnite amp sweet dream
ham,got called tool
ham,brother genius
ham,im really really broke oh amount small even ltgt
ham,lmao know well
spam,fantasy football back tv go sky gamestar sky active play £250k dream team scoring start saturday register nowsky opt 88088
ham,one day billion class right
ham,im good registered vote
ham,im school n ill da lab stuff give call ü r done
ham,huh cant go 2 ur house empty handed right
ham,well im desperate ill call armand
ham,went ganesh dress shop
ham,e msg jus u said thanks gift
ham,que pas un buen tiempo something like
ham,hi hope good day better night
ham,bring got
ham,hey got mail
ham,u turn heater heater set ltgt degree
ham,honey pls find much sell predicte nigeria many time used important reply monday
spam,last chance 2 claim ur £150 worth discount voucherstext yes 85023 nowsavamobmember offer mobile c 08717898035 £300 sub 16 remove txt x stop
ham,haha mayb ure rite u know well da feeling liked someone gd lor u faster go find one gal group attached liao
ham,askd u question hour answer
ham,place man
ham,im serious money base
ham,hey sexy bun day word morning ym think
spam,ur balance £500 ur next question sang uptown girl 80 2 answer txt ur answer 83600 good luck
ham,r meeting
ham,mum going robinson already
ham,watch lor saw swatch one thk quite ok ard 116 need 2nd opinion leh
ham,hey leave friday wait ask superior tell
ham,aight call youre close
ham,dunno dat wat told ok lor
ham,howz person story
ham,hey hunonbus goin 2 meet want 2go 4a meal donyt feel like cuz 2 get last bus homebut he sweet latelyxxx
ham,ay wana meet satü wkg sat
ham,txting driving
ham,spending new year brother family let plan meet next week ready spoiled
ham,thats cool want please
spam,u subscribed best mobile content service uk £3 per ten day send stop 83435 helpline 08706091795
ham,mmmmmm love youso much ahmad cant wait year begin every second take closer side happy new year love
ham,dear relieved westonzoyland going plan end
ham,ask g iouri ive told story like ten time already
ham,university southern california
ham,good evening
ham,kkwhy cant come search job
ham,ya tel wats ur problem
ham,dun cut short leh u dun like ah failed shes quite sad
ham,didnt work oh ok goodnight ill fix ready time wake dearly missed good night sleep
ham,promise take good care princess run please send pic get chance ttyl
ham,call get chance plz lt3
ham,lil fever fine
ham,cool breeze bright sun fresh flower twittering bird waiting wish u goodmorning amp nice day
ham,yeah there barely enough room two u x many fucking shoe sorry man see later
ham,kate jackson rec center 7ish right
ham,wow healthy old airport rd lor cant thk anything else ill b bathing dog later
ham,ssnervous ltgt
ham,yeah wheres class
ham,hi love go day fuck morning woke dropped cell way stair seems alright phews miss
ham,yeah probably sure ilol let u know personally wuldnt bother ur goin mite well
spam,1 new message please call 08718738034
spam,bloomberg message center 447797706009 wait apply future httpcareers bloombergcom
ham,sleeping nt feeling well
ham,good afternoon glorious anniversary day sweet j hope find happy content prey think send teasing kiss across sea coaxing image fond souveniers cougarpen
spam,yes place town meet exciting adult single uk txt chat 86688 150pmsg
ham,purchase stuff today mail po box number
ham,exwife able kid want kid one day
ham,yar lor u noe u used dat route
ham,supposed wake gt
ham,ltgt great loxahatchee xmas tree burning update totally see star
ham,ok thats great thanx lot
spam,want new nokia 3510i colour phone delivered tomorrow 200 free minute mobile 100 free text free camcorder reply call 08000930705
ham,time come tomorrow
ham,sat right okay thanks
ham,real u getting yo need 2 ticket one jacket im done already used multis
ham,hungry buy food good lei mum n yun dun wan juz buy little bit
spam,freemsgfav xmas tonesreply real
ham,one best dialogue cute reltnship wen die dont come near body bcoz hand may come 2 wipe ur tear timegud ni8
ham,glad see reply
spam,recieve tone within next 24hrs term condition please see channel u teletext pg 750
ham,surely result offer
ham,yo call get chance friend mine wanted ask big order
ham,mu try figure much money everyone gas alcohol jay trying figure weed budget
ham,oic better quickly go bathe n settle
ham,nope waiting sch 4 daddy
ham,prof passed paper sem congrats student enna kalaachutaarama prof gud mrng
ham,happened yo date
ham,uncle boye need movie oh guide plus know torrent particularly legal system slowing gr8 day plus started co dont meet online honey moon
ham,probably gon na swing wee bit
ham,long get reply defer admission til next semester
ham,please protect ethreats sib never asks sensitive information like passwordsatmsms pin thru email never share password anybody
ham,ha ha ha good joke girl situation seeker
ham,guy close
spam,come take little time child afraid dark become teenager want stay night
ham,thought bout drink tap spile seven pub gas st broad st canal ok
ham,ya knw u vl givits ok thanks kanoanyway enjoy wit ur family wit 1st salary
ham,nonenowhere ikno doesdiscountshitinnit
ham,ive got ltgt way could pick
ham,mag meeting avo point
ham,u find sitter kaitlyn sick slept day yesterday
ham,im cant give everything want need actually could better yor ownyouve got money cant get work cant get man cant pay rent cant even fill fucking gas tank yes im stressed depressed didnt even call home thanksgiving cuz ill tell im nothing
ham,im home please call
ham,done internet connection v slow ‘ send try later first thing tomo
ham,alright new goal
ham,lem know youre
spam,natalja 25f inviting friend reply yes440 no440 see wwwsmsacunat27081980 stop send stop frnd 62468
spam,free msg single find partner area 1000 real people waiting chat nowsend chat 62220cncl send stopcs 08717890890£150 per msg
ham,oh ok didnt know meant yep baby jontin
ham,whenevr ur sad whenevr ur gray remembr im 2 listn 2 watevr u wan na say jus walk wid little whileamp promise ill bring back ur smile
ham,xmas story peace xmas msg love xmas miracle jesus hav blessed month ahead amp wish u merry xmas
spam,urgent 4 costa del sol holiday £5000 await collection call 09050090044 toclaim sae tc pobox334 stockport sk38xh cost£150pm max10mins
ham,black shirt n blue jean thk c ü
ham,k jason say he gon na around ill around ltgt
ham,gudnitetcpractice going
ham,single line big meaning miss anything 4 ur best life dont miss ur best life anything gud nyt
ham,say he quitting least5times day wudnt take much notice nah didnt mind gon na see want come taunton tonight u tell
ham,shall send exe mail id
ham,get gift year didnt get anything bad
ham,dont file bagi work called mei tell find anything room
ham,sound like could lot time spent chastity device boy grin take beating like good dog going lounge nice long bath
ham,train back northampton im afraid im staying skyving today ho ho around wednesday though fancy comedy club week way
spam,registered optin subscriber ur draw 4 £100 gift voucher entered receipt correct an 80062 whats no1 bbc chart
spam,urgent mobile number awarded £2000 bonus caller prize call 09058095201 land line valid 12hrs
ham,hows pain deary r u smiling
ham,new deus ex game comin early next yr
ham,thk 50 shd ok said plus minus 10 ü leave line paragraph
ham,guess thats worried must know there way body repair im quite sure shouldnt worry well take slow first test guide ovulation relax nothing youve said reason worry ill keep followin
ham,u wan 2 come dinner tonight
ham,‘ got salt rub open wound like
ham,pls help tell sura im expecting battery hont pls send message download movie thanks
ham,going dinnermsg
ham,ard 530 lor ok message ü lor
spam,free camera phone linerental 449month 750 cross ntwk min 12 price txt bundle deal also avble call 08001950382 call2optoutj mf
spam,urgent mobile number £2000 bonus caller prize 100603 2nd attempt reach call 09066368753 asap box 97n7qp 150ppm
ham,ok thanx gd nite 2 ü
ham,home always chat
spam,chosen receive £350 award pls call claim number 09066364311 collect award selected receive valued mobile customer
ham,think …thanks see tomo
ham,escape theatre going watch kavalan minute
spam,guess somebody know secretly fancy wan na find give u call 09065394514 landline datebox1282essexcm61xn 150pmin 18
ham,ask u meeting da ge tmr nite
ham,messageno responcewhat happend
ham,yesterday true true
ham,crucify c told earlier
ham,going college pa else ill come self pa
ham,yeah gang ready
spam,winner specially selected receive £1000 cash £2000 award speak live operator claim call 087147123779am7pm cost 10p
ham,hope youre much fun without see u tomorrow love jess x
ham,send id password
ham,ya nowonion roast
ham,tmrw im finishing 9 door
ham,dear mood cant drive brother drive
ham,k wen ur free come home also tel vikky hav sent mail also better come evening il free today aftr 6pm
ham,actual exam harder nbme
ham,somewhere fredericksburg
ham,said went back bed cant sleep anything
ham,yeah dont go bed ill back midnight
ham,double eviction week spiral michael good riddance
ham,know mood today
ham,thank like well
ham,wonder phone battery went dead tell love babe
ham,call like ltgt time oh give u hypertension oh
ham,babe miiiiiiissssssssss need crave geeee im sad without babe love
ham,either idea know anyplaces something
spam,welcome select o2 service added benefit call specially trained advisor free mobile dialling 402
ham,cool last little getting time soon
ham,oh icic k lor den meet day
ham,nothing u dinner w u
ham,standing
ham,r outside already
ham,hey pay salary de ltgt
ham,oh k got job whats
ham,ok ive sent u da latest version da project
ham,dont forget though love walk beside watching keeping heart warm
spam,would like see xxx pic hot nearly banned uk
ham,yunny im goin late
ham,cool ill text
spam,congratulation ur awarded either £500 cd gift voucher free entry 2 £100 weekly draw txt music 87066 tncs wwwldewcom 1 win150ppmx3age16
spam,adult 18 content video shortly
ham,oh half hour much longer syria canada eh wow must get much work done day u extra time grin
ham,please dont text anymore nothing else say
ham,great comedycant stop laughing da
ham,yup thk cine better co need 2 go 2 plaza mah
spam,wan na get laid 2nite want real dogging location sent direct ur mobile join uk largest dogging network txt park 69696 nyt ec2a 3lp £150msg
ham,huh fast dat mean u havent finished painting
ham,yuou working getting pc mom find spot would work need
ham,wat time u wan 2 meet later
ham,wat make people dearer de happiness dat u feel u meet de pain u feel u miss dem
ham,k ill head min see
spam,tried contact offer new video phone 750 anytime network min half price rental camcorder call 08000930705 reply delivery wed
ham,dear know ltgt th ltgt th birthday loving gopalettan planning give small gift day like participate welcome please contact admin team detail
ham,buy pizza meat lover supreme u get pick
ham,beauty sleep help ur pimple
ham,goodo yes must speak friday eggpotato ratio tortilla needed
ham,alright ill make sure car back tonight
ham,nothing meant money enters account bank remove flat rate someone transfered ltgt account ltgt dollar got removed bank differ charge also differbe sure trust 9ja person sending account detail co
ham,check error difficulty correction
ham,playin space poker u
ham,truekdo u knw dis ltgt
ham,en chikku nange bakra msg kalstiyathen teacoffee
ham,mean get door
ham,tmr timin still da wat co got lesson 6
ham,sure get acknowledgement astoundingly tactless generally faggy demand blood oath fo
ham,thanx 4 2day u r goodmate think ur rite sary asusual1 u cheered love u franyxxxxx
ham,ok need tell anything going sleep good night
ham,hello got st andrewsboy long way cold keep posted
ham,nope wif si lor aft bathing dog bathe look like going 2 rain soon
ham,horrible gal sch stuff come u got mc
ham,unni thank dear rechargerakhesh
ham,aft finish lunch go str lor ard 3 smth lor u finish ur lunch already
ham,sent de webadres geting salary slip
ham,tell who pls
ham,ü wan 2 meet n combine part hows da rest da project going
ham,exact intention
ham,one joy lifeis waking daywith thought somewheresomeone care enough tosend warm morning greeting
ham,yes rent expensive way save
ham,lmao wheres fish memory need
spam,free 1st week no1 nokia tone 4 ur mob every week txt nokia 87077 get txting tell ur mate zed pobox 36504 w45wq norm150ptone 16
ham,im meeting call later
ham,eh den sat u book e kb liao huh
spam,thanks ringtone order reference number x49 mobile charged 450 tone arrive please call customer service 09065989182 colourredtextcolourtxtstar
ham,yes dont care cause know
ham,goin workout lor muz lose e fat
ham,screaming mean shouting
ham,alrite hunnywot u 2 2nite didnt end goin town jus da pub instead jus chillin da mo bedroomlove jen xxx
ham,see letter b car
ham,making dinner
ham,ha ha popped loo helloed hello
spam,hi amy sending free phone number couple day give access adult party
spam,nokia 7250i get win free auction take part send nokia 86021 hgsuite3422lands roww1jhl 16
ham,kthen special
ham,sir good morning hope good weekend called let know able raise ltgt dad however said would make rest available mid feb amount still quite short hoping would help good day abiola
ham,thank much selflessness love plenty
ham,feel like dick keep sleeping text facebook message sup town
ham,kind missed train co asthma attack nxt one half hr driving sure park
spam,eastenders tv quiz flower dot compare violet e tulip f lily txt e f 84025 4 chance 2 win £100 cash wkent150p16
ham,im smoking people use wylie smoke much justify ruining shit
ham,man carlos definitely coming mu tonight excuse
ham,hi dear call urgnt dont know whats problem dont want work problem least tell wating reply
ham,make 3 4 fuck sake x
ham,ok ill right later
spam,free entry £250 weekly comp send word enter 84128 18 tc wwwtextcompcom cust care 08712405020
ham,pathaya enketa maraikara pa
ham,ee msg na poortiyagi odalebeku hanumanji 7 name 1hanuman 2bajarangabali 3maruti 4pavanaputra 5sankatmochan 6ramaduth 7mahaveer ee 7 name ltgt janarige ivatte kalisidare next saturday olage ondu good news keluviri maretare inde 1 dodda problum nalli siguviri idu matra ltgt true dont neglet
ham,u free sat rite u wan 2 watch infernal affair wif n darren n mayb xy
ham,buy
ham,carlos pick ill swing usf little bit
ham,time ur flight tmr
ham,wil ltgt minute got space
ham,erm woodland avenue somewhere get parish magazine telephone number
ham,tessypls favor pls convey birthday wish nimyapls dnt forget today birthday shijas
ham,know people hit fuck yes
ham,ugh got ta drive back sd la butt sore
ham,never try alone take weight tear come ur heart fall ur eye always remember stupid friend share bslvyl
ham,great hope like man well endowed ltgt inch
ham,yes thought thanks
ham,place want da
ham,nope think go monday sorry replied late
ham,yup ü comin
ham,annoying isnt
ham,pick rayan macleran
ham,like made throw smoking friend car one time awesome
ham,sorry dai thought calling lot timeslil busyi call noon
ham,2 student solved cat question xam 532 ltgt 924 ltgt 863 ltgt 725 tell answer u r brilliant1thingi got answr
ham,nah im perpetual dd
spam,unique enough find 30th august wwwareyouuniquecouk
ham,lick every drop ready use mouth well
ham,send new number
spam,phony £350 award today voda number ending xxxx selected receive £350 award match please call 08712300220 quoting claim code 3100 standard rate app
ham,kaiez enjoy ur tuition gee thk e second option sound beta ill go yan jiu den msg u
ham,hex place talk explain
ham,aight tomorrow around ltgt
ham,big god bring success
ham,he gon na worry nothing wont give money use
ham,happy new year u ur familymay new year bring happiness stability tranquility ur vibrant colourful life
ham,u studying sch going home anyway ill b going 2 sch later
ham,stupidits possible
spam,18 day euro2004 kickoff u kept informed latest news result daily unsubscribe send get euro stop 83222
ham,wont move morphine
spam,free 1st week no1 nokia tone 4 ur mob every week txt nokia 8007 get txting tell ur mate wwwgetzedcouk pobox 36504 w45wq norm150ptone 16
ham,either way work ltgt year old hope doesnt bother
ham,aiyar sorry lor forgot 2 tell u
ham,aight text youre back mu ill swing need somebody get door
spam,forwarded 88877free entry £250 weekly comp send word enter 88877 18 tc wwwtextcompcom
ham,gobi art college
spam,u win £100 music gift voucher every week starting txt word draw 87066 tscs wwwidewcom skillgame 1winaweek age16 150ppermesssubscription
ham,lol ok ill try send warned sprint dead slow youll prolly get tomorrow
ham,feel always happy slowly becomes habit amp finally becomes part life follow happy morning amp happy day
ham,ill 3 min look
ham,yup thk r e teacher said make face look longer darren ask 2 cut short
ham,dont worry easy ingredient
spam,id like tell deepest darkest fantasy call 09094646631 60pmin stop text call 08712460324 nat rate
ham,hows queen going royal wedding
spam,talk sexy make new friend fall love world discreet text dating service text vip 83110 see could meet
ham,ya ü taking ure practical lesson start june
spam,free video camera phone half price line rental 12 mths 500 cross ntwk min 100 txts call mobileupd8 08001950382 call2optout674
spam,sm service inclusive text credit pls goto wwwcomuknet login 3qxj9 unsubscribe stop extra charge help 08702840625comuk 220cm2 9ae
ham,edison rightly said fool ask question wise man answer know u speechless viva gmgngegnt
spam,call 09094100151 use ur min call cast 10pmin mob vary service provided aom gbp5month aom box61m60 1er u stop age 18
ham,water logging desert geoenvironmental implication
ham,actually sleeping still might u call back text gr8 rock si send u text wen wake
ham,long applebees fucking take
spam,ur cashbalance currently 500 pound maximize ur cashin send go 86688 150pmsg cc 08718720201 hgsuite3422lands roww1j6hl
ham,got new job bar airport satsgettin 447per hour mean lie keep touch
ham,come right ahmad
ham,better still catch let ask sell ltgt
spam,sunshine quiz wkly q win top sony dvd player u know country algarve txt ansr 82277 £150 sptyrone
spam,simpson movie released july 2007 name band died start film agreen day bblue day cred day send b c
spam,twinks bear scallies skin jock calling dont miss weekend fun call 08712466669 10pmin 2 stop text call 08712460324nat rate
ham,ugh dont wan na get bed warm
ham,hmmm thk sure got time hop ard ya go 4 free abt muz call u discus liao
ham,im turning phone mom telling everyone cancer sister wont stop calling hurt talk cant put see u u get home love u
ham,im done oredi
spam,thanks ringtone order ref number k718 mobile charged £450 tone arrive please call customer service 09065069120
ham,ok msg u b4 leave house
ham,realy sorryi dont recognise number confused r u please
ham,saw messageit k da
ham,hows watch resizing
ham,siva hostel aha
ham,thats cool sometimes slow gentle sonetimes rough hard
spam,u 447801259231 secret admirer looking 2 make contact ufind rreveal think ur specialcall 09058094597
spam,free2day sexy st george day pic jordantxt pic 89080 dont miss every wk saucy celeb4 pic c pocketbabecouk 0870241182716 £3wk
ham,catch bus frying egg make tea eating mom left dinner feel love
ham,dear denying word please
spam,thanks vote sing along star karaoke mobile free link reply sing
ham,omg one thing another cat worm bad day end
spam,contract mobile 11 mnths latest motorola nokia etc free double min text orange tariff text yes callback remove record
spam,sexy sexy cum text im wet warm ready porn u fun msg free recd msg 150p inc vat 2 cancel text stop
ham,reach home safe n sound liao
ham,wnt buy bmw car urgentlyits vry urgentbut hv shortage ltgt lacsthere source arng dis amt ltgt lacsthats prob
ham,thought praps meant another one goodo ill look tomorrow
ham,compliment away system side
ham,babe lost
ham,probably money worry thing coming due several outstanding invoice work two three month ago
ham,thanks yesterday sir wonderful hope enjoyed burial mojibiola
ham,xy ur car u picking
spam,please call customer service representative freephone 0808 145 4742 9am11pm guaranteed £1000 cash £5000 prize
ham,come home one last time wont anything trust
ham,princess bet brothas chasing
ham,hi chachi tried calling u unable reach u pl give missed cal u c tiz msg kanagu
ham,eh sorry leh din c ur msg sad already lar watching tv u still office
ham,k want u come
ham,quite ok bit ex u better go eat smth else ill feel guilty
ham,text way cup stop work bus
ham,tot u outside co darren say u come shopping course nice wat jus went sim lim look mp3 player
ham,cant pick phone right pls send message
spam,currently message awaiting collection collect message call 08718723815
ham,quite lor dun tell wait get complacent
ham,sorry ill call later
ham,5 2 work timing
ham,room
ham,dont search love let love find u thats called falling love bcoz u dont force u fall u know smeone hold u bslvyl
spam,hi customer loyalty offerthe new nokia6650 mobile £10 txtauction txt word start 81151 get 4tctxt tc 150pmtmsg
ham,bill letter ’ expecting one orange ’ bill may still say orange
spam,cmon babe make horny turn txt fantasy babe im hot sticky need reply cost £150 2 cancel send stop
ham,thk u dun haf 2 hint e forum already lor co told ron n darren going 2 tell shuhui
ham,whole car appreciated last two dad map reading semi argument apart thing going ok p
ham,hey cutie go wale kinda ok like hill shit still avent killed
ham,play w computer aiyah tok 2 u lor
ham,think actually talk call bos morning went place last year told could go get car fixed cheaper kept telling today much hoped would come back always regretted getting number etc
ham,ok april cant wait
ham,doesnt g class early tomorrow thus shouldnt trying smoke ltgt
spam,fancy shag dointerested sextextukcom txt xxuk suzy 69876 txts cost 150 per msg tncs website x
ham,hi shanilrakhesh herethanksi exchanged uncut diamond stuffleaving back excellent service dino prem
ham,yeah probably earlier
ham,class hour sorry
ham,im town ill jus take mrt later
ham,huh late fr dinner
ham,hungry
spam,credit topped httpwwwbubbletextcom renewal pin tgxxrz
ham,cant dont number
spam,ringtone club get uk single chart mobile week choose top quality ringtone message free charge
ham,yup paragon havent decided whether 2 cut yet hee
ham,since side fever vomitin
ham,going goodno problembut still need little experience understand american customer voice
spam,text meet someone sexy today u find date even flirt u join 4 10p reply name age eg sam 25 18 msg recdthirtyeight penny
ham,tension ahwhat machiany problem
ham,like v shock leh co telling shuhui like telling leona also like dat almost know liao got ask abt ur reaction lor
ham,sorry trouble u buy 4d dad 1405 1680 1843 2 big 1 small sat n sun thanx
ham,popping ltgt ibuprofen help
spam,123 congratulation week competition draw u £1450 prize claim call 09050002311 b4280703 tcsstop sm 08718727868 18 150ppm
ham,hey sexy bun told adore loverboy hope remember thank sister law meatball grin love babe
ham,hi roger cl
ham,goodnight sleep well da please take care pa please
ham,friendship game play word say doesn\t start march end may tomorrow yesterday today e
ham,ic lotta childporn car
ham,bothering trust answer pls
ham,hey sorry didntgive ya bellearlier hunnyjust bedbut mite go 2 thepub l8tr uwana mt uploads luv jenxxx
ham,ü dun need pick ur gf
ham,bloo bloo bloo ill miss first bowl
ham,staffsciencenusedusgphyhcmkteachingpc1323
ham,yup im free
ham,available soiree june 3rd
ham,yes appt
ham,wont anything de
ham,wonder co dun rem seeing silver car thk saw black one
spam,ur chance win £250 cash every wk txt action 80608 tscs wwwmovietriviatv custcare 08712405022 1x150pwk
ham,lei
ham,please tell special stock talking
ham,much blackberry bold2 nigeria
ham,hi wont b ard 4 christmas enjoy n merry xmas
ham,well told others youd marry
ham,hey babe friend cancel still visit
ham,hows husband
spam,new mobile 2004 must go txt nokia 89545 collect today £1 www4tcbiz 2optout 08718726270150gbpmtmsg18 txtauction
spam,mila age23 blonde new uk look sex uk guy u like fun text mtalk 6986618 30pptxt 1st 5free £150 increment help08718728876
spam,bloomberg message center 447797706009 wait apply future httpcareers bloombergcom
ham,ok good making money
ham,saw guy doll last night patrick swayze great
ham,check room befor activity
ham,im home n ready
ham,late need go n get da laptop
ham,anyway im going shopping co si done yet dun disturb u liao
ham,telling tell one treat hi hi hi
ham,pick bout 730ish time going
ham,come n pick ü come immediately aft ur lesson
ham,designation software developer may get chennai
ham,u ask next sat make im ok lor
ham,download clear movie dvd copy
ham,networking job
ham,3 pa selected
ham,much payed suganya
ham,im going 4 lunch wif family aft dat go str 2 orchard lor
ham,okie
ham,good afternoon starshine hows boytoy crave yet ache fuck sip cappuccino miss babe teasing kiss
ham,r ü comin back dinner
ham,nan sonathaya soladha bos
ham,somewhr someone surely made 4 u god decided perfect time make u meet dat person till den enjoy ur crush
ham,nofew hour beforewent hair cut
ham,wats da model num ur phone
ham,hmmm mayb try e shoppin area one forgot e name hotel
ham,arm fine hows cardiff uni
ham,pussy perfect
ham,thk ü got ta go home urself co ill b going shopping 4 frens present
ham,todaysundaysunday holidayso work
