label,message
ham,im da bus going home
ham,thats cool ill come like ltgt ish
spam,ur ringtone service changed 25 free credit go club4mobilescom choose content stop txt club stop 87070 150pwk club4 po box1146 mk45 2wt
ham,beautiful truth gravity read carefully heart feel light someone feel heavy someone leaf good night
ham,come home dont want u miserable
ham,tell reached
ham,first time history need comfort luxury sold price india onionrs ltgt petrolrs ltgt beerrs ltgt shesil ltgt
ham,shall come get pickle
ham,im working technical support voice process
ham,waking 4 afternoon sup
ham,u mean u almost done done wif sleeping tot u going take nap yup send liao im picking ard 4 smth lor
ham,carlosll minute still need buy
ham,seems unnecessarily hostile
ham,another month need chocolate weed alcohol
ham,leaving yet ok lor go elsewhere n eat u thk
ham,see thought
ham,ü v fan
ham,surfing online store offer want buy thing
ham,wats dear sleeping ah
ham,blanket sufficient thx
ham,said kiss kiss cant sound effect gorgeous man isnt kind person need smile brighten day
ham,sent ltgt buck
ham,yesmum lookin strong
ham,gon na go get taco
spam,wan2 win meetgreet westlife 4 u m8 currently tour 1unbreakable 2untamed 3unkempt text 12 3 83049 cost 50p std text
ham,arngd marriage u r walkin unfortuntly snake bite u bt love marriage dancing frnt snake amp sayin bite bite
ham,pick ur fone u dumb
ham,honestly ive made lovely cup tea promptly dropped key burnt finger getting
ham,said look pretty wif long hair wat thk he cutting quite short 4 leh
ham,awesome think get 8th usf time tonight
ham,ill little closer like bus stop street
ham,guy
spam,please call customer service representative freephone 0808 145 4742 9am11pm guaranteed £1000 cash £5000 prize
ham,slept thinkthis time ltgt pm dangerous
ham,much r ü willing pay
ham,take ltgt min
ham,end might still vomit okay everything come
ham,yup havent want go yoga call book
ham,ok every night take warm bath drink cup milk youll see work magic still need loose weight know
ham,120 call cost guess isnt bad miss ya need ya want ya love ya
ham,dont think spatula hand
spam,congratulation ur awarded either yr supply cd virgin record mystery gift guaranteed call 09061104283 tscs wwwsmsconet £150pm approx 3mins
spam,dear voucher holder claim week offer pc please go httpwwwetlpcoukreward tscs apply
spam,private 2003 account statement 07808247860 show 800 unredeemed point call 08719899229 identifier code 40411 expires 061104
ham,ü thk wat eat tonight
ham,dad gon na call get work ask crazy question
spam,receiving week triple echo ringtone shortly enjoy
ham,hey hey werethe monkeespeople say monkeyaround howdy gorgeous howu doin foundurself jobyet sausagelove jen xxx
ham,hows thing quick question
ham,good weekend
ham,yeah think usual guy still passed last night get ahold anybody let know ill throw
ham,u early
ham,dont hesitate know second time weakness like keep notebook eat day anything changed day sure nothing
ham,nvm im going wear sport shoe anyway im going late leh
ham,‘ £6 get ok
spam,congratulation thanks good friend u £2000 xmas prize 2 claim easy call 08712103738 10p per minute btnationalrate
ham,also hi wesley howve
ham,haiyoh maybe hamster jealous million
ham,dint come u
ham,rajipls favour pls convey birthday wish nimya pls today birthday
ham,well right im gon na get check today steam salespee text want come get
ham,ok lor
ham,ill probably tomorrow even later tonight somethings going
ham,world famamus
ham,er yep sure prop
spam,updatenow 12mths half price orange line rental 400minscall mobileupd8 08000839402 call2optoutj5q
ham,4 let go bill miller
ham,yet chikkugoing room nw im bus
ham,generally isnt one uncountable noun u dictionary piece research
spam,want explicit sex 30 sec ring 02073162414 cost 20pmin
ham,wishing family merry x ma happy new year advance
ham,let know contact ive settled room let know ok
ham,thanks message really appreciate sacrifice im sure process direct pay find way back test tomorrow im class wonderful day
ham,get free call
ham,hello ucall wen u finish wrki fancy meetin wiv u tonite need break dabooks 4 hr last nite2 today wrk
ham,dare change ring
ham,ill mu like ltgt second
spam,cashbincouk get lot cash weekend wwwcashbincouk dear welcome weekend got biggest best ever cash give away
ham,wen get spiritual deep thats great
ham,grandma oh dear u still ill felt shit morning think hungover another night leave sat
ham,yetunde im sorry moji seem busy able go shopping please find way get wanted u get please forgive reply free via yahoo messenger
ham,took hooch walk toaday fell splat grazed knee everything stayed home see tomorrow
ham,u calling right call hand phone
ham,account refilled successfully inr ltdecimalgt keralacircle prepaid account balance r ltdecimalgt transaction id kr ltgt
ham,yeah jus rite
ham,easy mate guess quick drink bit ambitious
ham,shit wasnt surprised went spent evening french guy met town fooled around bit didnt let fuck
ham,reverse cheating mathematics
ham,hey dont forget mine possession property mmm childish smile
ham,hey whats u sleeping morning
spam,free ringtone text first 87131 poly text get 87131 true tone help 0845 2814032 16 1st free tone 3x£150pw e£nd txt stop
ham,first time everything
ham,enjoying semester take care brother
ham,exam february 4 wish great day
ham,kkim going tirunelvali week see uncle already spend amount taking dress want moneyi give feb 1
ham,come mu sorting narcotic situation
ham,boy best get yo as quick
ham,anytime
ham,yes meet town co go gep home could text bus stop dont worry well finished march … ish
spam,sim subscriber selected receive bonus get delivered door txt word ok 88600 claim 150pmsg exp 30apr
ham,absolutely love south park recently started watching office
ham,peteis phone still jenny college leannewhat
ham,interested like
spam,lastest stereophonics marley dizzee racal libertine stroke win nookii game flirt click themob wap bookmark text wap 82468
ham,want ltgt r dado
spam,urgent trying contact u today draw show £800 prize guaranteed call 09050001808 land line claim m95 valid12hrs
ham,oh yeah diet flew window
ham,oh unintentionally bad timing great finger train play along give fifteen min warning
ham,many day since
spam,important customer service announcement premier
ham,pen thing beyond joke wont biro dont master cant ever
ham,drop tank
ham,awesome plan get time like ltgt ill text detail wee bit
ham,nationwide auto centre something like newport road liked
ham,im going 2 orchard laready reaching soon u reaching
ham,jus came back fr lunch wif si u leh
ham,yeah get random dude need change info sheet party ltgt 7 never study safe
ham,messageno responcewhat happend
spam,rock yr chik get 100 filthy film xxx pic yr phone rply filth 69669 saristar ltd e14 9yt 08701752560 450p per 5 day stop2 cancel
spam,urgent please call 09061213237 landline £5000 cash luxury 4 canary island holiday await collection tc sae po box 177 m227xy 150ppm 16
ham,hi harishs rent transfred ur acnt
spam,freemsg hey im buffy 25 love satisfy men home alone feeling randy reply 2 c pix qlynnbv help08700621170150p msg send stop stop txts
ham,sorry ill call later
ham,aiyar dun disturb u liao thk u lot 2 aft ur cupboard come
ham,oh yeah clearly fault
ham,hiya sorry didnt hav signal havent seen heard neither unusual ill put case get sort hug snogs
spam,money r lucky winner 2 claim prize text money 2 88600 £1million give away ppt150x3normal text rate box403 w1t1jy
ham,wat make people dearer de happiness dat u feel u meet de pain u feel u miss dem
ham,ok lor
ham,neft transaction reference number ltgt r ltdecimalgt credited beneficiary account ltgt lttimegt ltgt
ham,nah cant help ive never iphone
ham,yep dereks house see sunday lt3
ham,many thing antibiotic used chest abdomen gynae infection even bone infection
ham,challenge know
ham,hi darlin finish 3 u 1 2 pick meet text back number luv kate xxx
spam,free entry £250 weekly competition text word win 80086 18 tc wwwtxttowincouk
ham,busy trying finish new year looking forward finally meeting
ham,remember hurt day satanic imposter meneed pay priceso itmay destiny keep going u said pray get mind get
ham,picking various point
spam,2nd time tried contact u u £1450 prize claim call 09053750005 b4 310303 tcsstop sm 08718725756 140ppm
ham,ron say fri leh n said ding tai feng cant make reservation said wait lor
spam,dear voucher holder claim week offer pc please go httpwwwetlpcoukexpressoffer tscs apply stop text txt stop 80062
ham,dear sirsalam alaikkumpride pleasure meeting today tea shopwe pleased send contact number qatarrakhesh indianpls save numberrespectful regard
ham,ok leave need ask
ham,usualiam fine happy amp well
spam,customer service announcement recently tried make delivery unable please call 07090298926 reschedule ref9307622
ham,told coming wednesday
spam,guaranteed £1000 cash £2000 prizeto claim yr prize call customer service representative
ham,hear loud scream ltgt minute cause gyno shoving thing dont belong
spam,freemessage jamsterget crazy frog sound poly text mad1 real text mad2 88888 6 crazy sound 3 gbpweek 16only tc apply
spam,urgent trying contact last weekend draw show £900 prize guaranteed call 09061701939 claim code s89 valid 12hrs
ham,yun buying school got offer 2000 plus
ham,k wat tht incident
ham,say thanks2
ham,ok lor
ham,full heat pa applyed oil pa
ham,sad story man last week bday wife didnt wish parent forgot n kid went work even colleague wish entered cabin pa said happy bday bos felt special askd 4 lunch lunch invited apartment went said u mind go bedroom minute ok sed sexy mood came 5 minuts latr wid caken wife parent kidz friend n colleague screaming surprise waiting sofa naked
spam,join uk horniest dogging service u sex 2nite sign follow instruction txt entry 69888 nytec2a3lpmsg150p
ham,anything lor toa payoh got place 2 walk meh
spam,reminder downloaded content already paid goto httpdoit mymoby tv collect content
ham,specialisation work slave labor look month sha co shakara 4 beggar
ham,got ur favorite oyster n got favorite sashimi ok lar dun say already wait ur stomach start rumbling
ham,cha quiteamuzing thatscool babeprobpop cu satthen hunny 4brekkie love jen xxx psxtra lrg portion 4 please
ham,moon come color dream star make musical sm give warm peaceful sleep good night
ham,dont make life stressfull always find time laugh may add year life surely add life ur year gud ni8swt dream
ham,lol boo hoping laugh
ham,wondarfull song
ham,right though cant give space want need really starting become issue going suggest setting definite move outif im still greece maybe ready
ham,got home babe still awake
ham,painful personal thought always try keep everybody happy time nobody recognises alone
ham,hey want crave miss need love ahmad saeed al hallaq
ham,short cute good person dont try prove gud noon
ham,yes pretty lady like single
spam,congratulation thanks good friend u £2000 xmas prize 2 claim easy call 08718726971 10p per minute btnationalrate
spam,moby pub quizwin £100 high street prize u know new duchess cornwall txt first name 82277unsub stop £150 008704050406 sp arrow
ham,remind get shall
ham,actually fuck whatever find excuse tampa point january though
ham,sent scream moan bed princess
ham,err cud im going 8pm havent got way contact
ham,would im still cozy exhausted last nightnobody went school work everything closed
ham,im done
ham,hello darlin ive finished college txt u finish u love kate xxx
ham,look like u wil b getting headstart im leaving bout 230ish u r desperate company could head earlierwe goin meet rummer
ham,dunno dad said coming home 2 bring u 4 lunch yup go w u lor call u reach school lor
ham,kkyesterday cbe
ham,u get pic msg phone
ham,depends would like treated
ham,dearme cherthalain case u r coming cochin pls call bfore u starti shall also reach accordinglyor tell day u r comingtmorow engaged an holiday
ham,left vague said would inform person accounting delayed rent discus housing agency renting another place checking online place around usc ltgt
ham,tell friend plan valentine day lturlgt
ham,im fine babe aint 2 much tho saw scary movie yest quite funny want 2mrw afternoon town mall sumthinxx
spam,hello need posh bird chap user trial prod champneys put need address dob asap ta r
spam,85233 freeringtonereply real
ham,abt making pic bigger
ham,sad story man last week bday wife didnt wish parent forgot n kid went work even colleague wish
ham,wewa 130 iriver 255 128 mb
ham,aslamalaikkuminsha allah tohar beeen muht albi mufti mahfuuzmeaning
ham,sent like
ham,aight well head
ham,aight thatll work thanks
spam,win £1000 cash prize prize worth £5000
ham,wishing beautiful day moment revealing even thing keep smiling enjoy
ham,oh kim watching
ham,people tour thought sofa thing sent curious sugar
ham,okay booked already including one bugis
spam,splashmobile choose 1000 gr8 tone wk subscrition service weekly tone costing 300p u one credit kick back enjoy
ham,work week
ham,call say coming today ok tell fool like ok
ham,arun u transfr amt
ham,geeee miss already know think fuck cant wait till next year together loving kiss
ham,let snow let snow kind weather brings ppl together friendship grow
ham,sleepingand surfing
ham,willing go aptitude class
ham,keep safe need miss already envy everyone see real life
ham,ill get tomorrow send
spam,hard live 121 chat 60pmin choose girl connect live call 09094646899 cheap chat uk biggest live service vu bcm1896wc1n3xx
ham,sorry ill call later
ham,night ended another day morning come special way may smile like sunny ray leaf worry blue blue bay gud mrng
ham,cool let know kick around ltgt ill day
spam,contract mobile 11 mnths latest motorola nokia etc free double min text orange tariff text yes callback remove record
ham,ah poop look like ill prob send laptop get fixed cuz gpu problem
ham,gon na blake night might able get little early
ham,reason team budget available last buy unsold player base rate
ham,r u sam p eachother meet go 2 house
ham,lol knew saw dollar store
ham,took mr owl 3 lick
ham,watching tv lor
ham,yo gon na still stock tomorrowtoday im trying get dubsack
ham,great shoot big load get ready
ham,mm entirely sure understood text hey ho weekend
ham,one doesnt stalk profile
ham,oh ya ya remember da
ham,fun fact although would think armand would eventually build tolerance shit considering much smoke get fucked like 2 hit
ham,alright see bit
ham,wat time ü finish
ham,okie
ham,wont touch permission
ham,bloody hell cant believe forgot surname mr ill give u clue spanish begin
ham,better made friday stuffed like pig yesterday feel bleh least writhing pain kind bleh
ham,joy father john john name joy father mandan
ham,also didnt get na hi hi hi hi hi
spam,well done 4 costa del sol holiday £5000 await collection call 09050090044 toclaim sae tc pobox334 stockport sk38xh cost£150pm max10mins
ham,planned yet going join company jan 5 onlydon know happen
ham,reach ten morning
ham,den weekday got special price haiz cant eat liao cut nail oso muz wait finish drivin wat lunch still muz eat wat
ham,cool want go kappa meet outside mu
ham,carlos taking sweet time usual let know patty donewant smoke ill tell haul as
ham,aiyah wait lor u entertain hee
ham,know thinkin malaria relax child cant handle malaria would worse gastroenteritis take enough replace loss temp reduce give malaria med vomit self limiting illness mean day completely stop
ham,oh ok prob
ham,dear call tmorrowpls accomodate
ham,ceri u rebel sweet dreamz little buddy c ya 2moro need bloke
ham,thats fine give call know want question
ham,please charge mobile get morning
ham,oic saw tot din c found group liao
ham,okok okthenwhats ur today plan
ham,hey ive booked 2 lesson sun liao
ham,dont know im raping dude poker
spam,urgent mobile awarded £2000 bonus caller prize 5903 final try contact u call landline 09064019788 box42wr29c 150ppm
spam,today voda number ending 5226 selected receive 350 award hava match please call 08712300220 quoting claim code 1131 standard rate app
ham,gudnitetcpractice going
spam,bored housewife chat n date 08717507711 btnational rate 10pmin landline
spam,boltblue tone 150p reply poly mono eg poly3 1 cha cha slide 2 yeah 3 slow jamz 6 toxic 8 come stop 4 tone txt
ham,dear got bus directly calicut
ham,nice day dear
ham,nothing
ham,sea lay rock rock envelope envelope paper paper 3 word
ham,take u shopping mark distract isaiahd
ham,package program well
ham,good well find way
ham,done handed celebration full swing yet
ham,em olowoyey uscedu great time argentina sad secretary everything blessing
ham,thanx yup coming back sun finish dinner going back 2 hotel time fly tog 4 exactly mth today hope well haf many mths come
ham,oi ami parchi na kicchu kaaj korte iccha korche na phone ta tul na plz plz
ham,aathiwhere dear
ham,hcl chennai requires fresher voice processexcellent english neededsalary upto ltgt call mssuman ltgt telephonic interview via indyarockscom
spam,smsservices yourinclusive text credit pls goto wwwcomuknet login 3qxj9 unsubscribe stop extra charge help 08702840625comuk 220cm2 9ae
ham,hey going quit soon xuhui working till end month
spam,winner specially selected receive £1000 cash £2000 award speak live operator claim call 087123002209am7pm cost 10p
spam,want 750 anytime network min 150 text new video phone five pound per week call 08002888812 reply delivery tomorrow
ham,lmao ok wont needing u hair anymore
ham,yeah usual guy town therere definitely people around know
ham,ltgt fast approaching wish u happy new year happy sankranti happy republic day happy valentine day happy shivratri happy ugadi happy fool day happy may day happy independence day happy friendshipmotherfatherteacherschildrens day amp happy birthday 4 u happy ganesh festival happy dasara happy diwali happy christmas ltgt good morning afternoon evening night rememberi first wishing u theseyours raj
ham,faith make thing possiblehope make thing worklove make thing beautifulmay three christmasmerry christmas
ham,size elephant tablet u shove um ur as
ham,yup need ill jus wait 4 e rain 2 stop
ham,im diet ate 1 many slice pizza yesterday ugh im always diet
ham,aathiwhere dear
ham,beautiful truth gravity read carefully heart feel light someone feel heavy someone leaf goodmorning
ham,study alone without anyones help cant need study
ham,well im glad didnt find totally disagreeable lol
ham,correct work today
ham,posible dnt live ltgt century cm frwd n thnk different
ham,oh shit thought trip loooooool make much sense grin sofa reference sleep couch link sent wasnt went trip oh didnt babe go celebration rent
ham,yeah got one lined u
ham,nutter cutter ctter cttergg cttargg ctargg ctagg ie
ham,although told u dat im baig face watch really like e watch u gave co fr u thanx 4 everything dat uve done today im touched
ham,2 doc appointment next week im tired shoving stuff ugh couldnt normal body
ham,actually getting ready leave house
ham,ok going sleep hope meet
ham,mean still think teju
ham,da run activate full version da
ham,time week ryan
ham,hi msg meim office
ham,eat fo lunch senor
spam,sexy single waiting text age followed gender wither f eg23f gay men text age followed g eg23g
ham,whats oga left phone home saw ur message hope good great weekend
spam,new 2 club dont fink met yet b gr8 2 c u please leave msg 2day wiv ur area 09099726553 reply promised carlie x calls£1minmobsmore lkpobox177hp51fl
ham,ü got wat buy tell u ü need come
ham,say slowly godi love amp need youclean heart bloodsend ten special people amp u c miracle tomorrow itplspls
ham,love girl office may wonder smiling sore
ham,im home doc gave pain med say everything fine
spam,guess somebody know secretly fancy wan na find give u call 09065394973 landline datebox1282essexcm61xn 150pmin 18
ham,new car house parentsi new job hand
ham,mode men left
ham,ok im sure time finish tomorrow wan na spend evening co would vewy vewy lubly love xxx
ham,cant pick phone right pls send message
ham,dance river
ham,u 2
ham,mobile numberpls sm ur mail idconvey regard achanammarakheshqatar
ham,long take get
ham,time want come
ham,im always yahoo messenger send message ill get may send mobile mode sha ill get reply
ham,bus leaf ltgt
ham,hey galsu wan na meet 4 dinner nìte
ham,know people still town
ham,making easy pay back ltgt yr say pay back earlier get
ham,ive reached already
ham,hi probably much fun get message thought id txt u co im bored james farting night
ham,today system sh get readyall well also deep well
ham,late
ham,yup already thanx 4 printing n handing
ham,great run ttyl
ham,hey tell blake address carlos wanted meet got lost he answering phone
ham,going take babe
ham,ltgt pple marry lover becz hav gud undrstndng dat avoids problem sent dis 2 u u wil get gud news friday person like tomorrow best day life dont break chain break suffer send ltgt frnds ltgt min whn u read
spam,forwarded 21870000hi mailbox messaging sm alert 40 match please call back 09056242159 retrieve message match cc100pmin
ham,k k pa lunch aha
ham,unless situation go gurl would appropriate
spam,5 free top polyphonic tone call 087018728737 national rate get toppoly tune sent every week text subpoly 81618 £3 per pole unsub 08718727870
ham,gr8 see message r u leaving congrats dear school wat r ur plan
spam,guaranteed 32000 award maybe even £1000 cash claim ur award call free 0800 18 legitimat efreefone number wat u think
ham,im outside island head towards hard rock youll run
ham,oooh got plenty
ham,goodmorning today late 2hrs back pain
ham,baby promise treat well bet take good care
spam,tried contact reply offer video phone 750 anytime network min half price line rental camcorder reply call 08000930705
spam,yes place town meet exciting adult single uk txt chat 86688 150pmsg
ham,nope ill come online
ham,co darren say ü considering mah ask ü
ham,come aftr ltdecimalgt cleaning house
ham,dnt worryuse ice piece cloth packalso take 2 tablet
ham,yeah ‘ stand close tho ‘ catch something
ham,rajipls favour pls convey birthday wish nimya pls today birthday
ham,oh forwarded message thought send
ham,slow using biolas fne
ham,think disturbing da
ham,yeshere tv always available work place
ham,sday joinedso training started today
ham,sent type food like
spam,07732584351 rodger burn msg tried call reply sm free nokia mobile free camcorder please call 08000930705 delivery tomorrow
ham,derek done class
ham,1 thing change sentence want 2 concentrate educational career im leaving
ham,gud mrng dear hav nice day
ham,ü pay first lar da stock comin
ham,great hear settling well whats happenin wit ola
ham,wen ur lovable bcums angry wid u dnt take seriously coz angry childish n true way showing deep affection care n luv kettoda manda nice day da
ham,dunno lei ü decide lor abt leona oops tot ben going n msg
ham,home also
spam,double min txts orange 12 price linerental motorola sonyericsson btooth freenokia free call mobileupd8 08000839402 or2optouthv9d
ham,thanx lot 4 ur help
ham,derp worse dude always want party dude file complaint three drug abuser life
ham,kay since already
ham,good day mine really busy much tomorrow night
ham,thats going ruin thesis
ham,kkhow sister kid
ham,love aathilove u lot
ham,still area restaurant ill try come back soon
ham,way ur home
ham,oh oh wasted den muz chiong sat n sun liao
ham,well im going aunty
ham,much got cleaning
ham,many people seems special first sight remain special till last sight maintain till life end shjas
ham,hurry ive weeddeficient like three day
ham,guy bitching acted like id interested buying something else next week gave u free
ham,today sorry day ever angry ever misbehaved hurt plz plz slap urself bcoz ur fault im basically good
ham,hello damn christmas thing think decided keep mp3 doesnt work
ham,hey tmr meet bugis 930
ham,right ill make appointment right
ham,much eighth
ham,sir late paying rent past month pay ltgt charge felt would inconsiderate nag something give great cost thats didnt speak however recession wont able pay charge month hence askin well ahead month end please help thanks
ham,lol u come idea
spam,show ur colour euro 2004 241 offer get england flag 3lions tone ur phone click following service message info
ham,545 lor ya go 4 dinner together
ham,dont think turn like randomlly within 5min opening
ham,people game im mall iouri kaila
ham,k addie amp art ill get home
ham,thanks da thangam feel happy dear also miss da
spam,december mobile 11mths entitled update latest colour camera mobile free call mobile update co free 08002986906
ham,yes know cheesy song frosty snowman
ham,sign maturity start saying big thing actually start understanding small thing nice evening bslvyl
ham,hey r watching movie tonight ill prob b home early
ham,always saying welp
ham,collect ur laptop
ham,aiyo u poor thing u dun wan 2 eat u bathe already
ham,think asking gym excuse lazy people jog
spam,sm auction nokia 7250i get win free auction take part send nokia 86021 hgsuite3422lands roww1jhl 16
spam,please call customer service representative freephone 0808 145 4742 9am11pm guaranteed £1000 cash £5000 prize
ham,oh love soooo good hear omg missed much today im sorry problem provider thank tming
ham,yeah basically time next week get away mom amp get 3
spam,updatenow xmas offer latest motorola sonyericsson nokia free bluetooth double min 1000 txt orange call mobileupd8 08000839402 call2optoutf4q
spam,mobile 11 month u r entitled update latest colour mobile camera free call mobile update co free 08002986030
ham,great
ham,stop old man get build snowman snow angel snowball fight
ham,friend u stay fb chat
