label,message
ham,lol grin im babe thanks thinking
ham,ok noe ure busy im really bored msg u oso dunno wat colour choose 4 one
ham,thank u better work cause feel used otherwise
ham,easy ahsen got selected mean good
spam,u outbid simonwatson5120 shinco dvd plyr 2 bid visit sm acsmsrewards 2 end bid notification reply end
ham,babe talking think good boy missing love
ham,storming msg wen u lift phne u say hello u knw wt real meaning hello name girl yes u knw dat girl margaret hello girlfrnd f grahmbell invnted telphone moralone 4get name person bt girlfrnd g n g h
ham,wat r u busy wif work
ham,wasnt well babe swollen gland throat end
ham,sorry never hear unless book one kinda jokethet really looking skinny white girl one lineyou much camera something like theyre casting look
ham,good afternoon love go day hope maybe got lead job think boytoy send passionate kiss across sea
ham,thank youve wonderful
ham,sorry ill call later meeting thing related trade please call arul ltgt
ham,way ur home
ham,oh thkin goin yogasana 10 den nd go 3 den rush parco 4 nb okie lor u call ready
ham,hellogorgeous hows u fone charge lst nitw wen u texd hopeu ad nice wkend im sure u lookin 4ward 2 cin u 2mrw luv jaz
ham,dont show far put new picture facebook
ham,haha leg neck killing amigo hoping end night burn think could swing like hour
ham,aah cuddle would lush id need lot tea soup kind fumbling
ham,im workin get job
ham,sad story man last week bday wife didnt wish parent forgot n kid went work even colleague wish
ham,meant say cant wait see u getting bored bridgwater banter
ham,ltgt g saw day ago guy want sell wifi ltgt 3g ltgt thats blanked
ham,want go
ham,ü go home liao ask dad pick 6
ham,k 2marrow coming class
ham,macha dont feel upseti assume mindsetbelieve one evening wonderful plan uslet life begin againcall anytime
ham,hey next sun 1030 there basic yoga course bugis go pilate intro next sat tell time r free
ham,dunno lei shd b driving lor co go sch 1 hr oni
spam,hi ya babe x u 4goten bout scammer getting smartthough regular vodafone respond get prem rate msgsubscription no used also beware
ham,justbeen overa week since broke already brain going mush
ham,ive sent ü part
ham,valentine game send dis msg ur friend 5 answer r someone really love u ques colour suit best
ham,co daddy arranging time c wat time fetch ü mah
ham,good afternoon boytoy go walking day get police abstract still wake miss babe
ham,ugh fuck im resubbing eve
ham,like personal sized
ham,get ready ltgt inch pleasure
ham,got like ltgt get later though get whatever feel like
ham,takin shower yeah ill leave im done
ham,bishan lar nearer need buy early co buy got ta park car
ham,dont worry though understand important put place poorly thought punishment face worst thing ever happened brb gon na go kill
spam,call freephone 0800 542 0578
ham,opinion 1 2 jada 3 kusruthi 4 lovable 5 silent 6 spl character 7 matured 8 stylish 9 simple pls reply
ham,way im going back
ham,dont know come ask question like dont mistake
ham,im happy babe woo hoo party dude
ham,im chennai velachery
ham,ball moving lotwill spin last difficult bat
spam,important information 4 orange user 0796xxxxxx today ur lucky day2 find log onto httpwwwurawinnercom there fantastic prizeawaiting
spam,loan purpose £500 £75000 homeowner tenant welcome previously refused still help call free 0800 1956669 text back help
ham,k tell anything
ham,hmm many unfortunately pic obviously arent hot cake kinda fun tho
spam,hot live fantasy call 08707509020 20p per min ntt ltd po box 1327 croydon cr9 5wb 0870k
ham,importantly discus u
ham,yup giving problem mayb ill jus leave
spam,free ringtone waiting collected simply text password mix 85069 verify get usher britney fml po box 5249 mk17 92h 450ppw 16
ham,boy late 2 home father power frndship
ham,lol mad first woke gave
ham,wheres mummy boy good bad positive negative mummy made wait hmmmm
ham,carlos took leave minute
ham,right meanwhile hows project twin comin
ham,u meet fren dun wan meet ah muz b guy rite
ham,thanks sending mental ability question
ham,plane give month end
ham,much getting
ham,kkim also finewhen complete course
ham,see half hour
ham,ill b going 2 sch mon si need 2 take smth
ham,cool text youre ready
ham,first answer question
ham,oh ic thought meant mary jane
ham,remains bro amongst bros
ham,messagesome text missing sendername missing number missing sentdate missing missing u lot thats everything missing sent via fullonsmscom
ham,could kiss feel next
ham,set place heart mind mind easily forgets heart always remember wish happy valentine day
ham,shall ask one thing dont mistake
ham,tuition 330 hm go 1120 1205 one mind
ham,speaking cash yet
ham,prabhaim sorydarealyfrm heart im sory
ham,
ham,yar say got error
ham,wish u feel alone
ham,hey r ü still online ive finished formatting
ham,hi wk ok hols yes bit run forgot hairdresser appointment four need get home n shower beforehand cause prob u
ham,k must book huh going yoga basic sunday
ham,wish great semester
ham,received understood n acted upon
ham,hey elaine today meeting still
ham,good evening roger
ham,love working home
ham,say ltgt year old man money im last ltgt still waiting check
spam,someone contacted dating service entered phone fancy find call landline 09111032124 pobox12n146tf150p
ham,de asking like
ham,ha wouldnt say didnt read anything way u seemed dont like 2 judgementali save friday pub
ham,open rebtel firefox load put plus sign user name place show two number lower number number pick number pin display okay
ham,hey im bored im thinking u wat r u
spam,dear dave final notice collect 4 tenerife holiday 5000 cash award call 09061743806 landline tc sae box326 cw25wx 150ppm
ham,message sent askin ltgt dollar shoul pay ltgt ltgt
ham,simple arithmetic percentage
ham,oh godtaken teethis paining
ham,greeting consider excused
ham,night ended another day morning come special way may smile like sunny ray leaf worry blue blue bay gud mrng
ham,ü b going esplanade fr home
ham,boo time u get u supposed take shopping today
ham,hurry home soup done
ham,im home
ham,sound better evening im costume im sure time finish tomorrow txt end
ham,fine miss much
spam,0anetworks allow company bill sm responsible supplier shop give guarantee sell b g
ham,sorry ill call later
ham,minimum walk 3miles day
ham,cute thought friendship necessary share every secret ur close frnd watever u shared true
ham,cps causing outage conserve energy
ham,maybe fat finger press button doesnt know
ham,yes princess want make happy
ham,still tonight
ham,wiskey brandy rum gin beer vodka scotch shampain wine kudiyarasu dhina vaazhthukkal
ham,dnt wnt tlk wid u
ham,ok ksry knw 2 sivatats askd
ham,apart one told yesterday
ham,k k watch film
ham,dear call
ham,hello hello hi lou sorry took long 2 reply left mobile friend lancaster got bak neway im sorry couldnt make ur bday 2 hun
ham,much ur hdd casing cost
ham,thats rude campus
ham,ever green quote ever told jerry cartoon person irritates u always one love u vry much fails express gud nyt
ham,ü give time walk
spam,guaranteed £1000 cash £2000 prize claim yr prize call customer service representative 08714712379 10am7pm cost 10p
ham,made payment dont much sorry would want fedex way
ham,haha awesome ive 4u couple time alls coming
ham,time u wrkin
ham,bus way calicut
ham,wot u 2 j
ham,need lar go engin co si art today
ham,dai ltgt naal eruku
ham,several sir
ham,pls pls send mail know relative coming deliver know cost risk benefit anything else thanks
ham,argh fuck nobody town
ham,good think could send pix would love see top bottom
ham,sure make sure know aint smokin yet
ham,sorry ill call later meeting
ham,please protect ethreats sib never asks sensitive information like passwordsatmsms pin thru email never share password anybody
ham,keep ten r shelf buy two egg
ham,awesome remember last time got somebody high first time diesel v
ham,thk shld b ya wana go 4 lesson haha go one whole stretch
ham,funny fact nobody teach volcano 2 erupt tsunami 2 arise hurricane 2 sway aroundn 1 teach hw 2 choose wife natural disaster happens
ham,th gower mate r u man good wale ill b back morrow c u wk msg 4  random
ham,sorry dude dont know forgot even dan reminded sorry hope guy fun
ham,probs hon u doinat mo
ham,watching tv lor nice one like lor
ham,kkim also finewhen complete course
spam,valentine day special win £1000 quiz take partner trip lifetime send go 83600 150pmsg rcvd custcare08718720201
ham,sorry c ur msg yar lor poor thing 4 one night tmr ull brand new room 2 sleep
ham,got another job one hospital data analysis something start monday sure thesis got finished
ham,shes fine good hear dear happy new year oh
ham,aiyah u ok already lar e nydc wheellock
ham,helloooo wake sweet morning welcome enjoy day full joy gud mrng
ham,many lick take get center tootsie pop
ham,sore throat scratch talk
ham,im movie call 4 wat
ham,broke list reason nobody town cant tell shes sarcastic faggy
ham,dunno lei thk mum lazy go neva ask yet
ham,take didnt phone callon friday assume wont year
spam,guaranteed £200 award even £1000 cashto claim ur award call free 08000407165 18 2 stop getstop 88222 php
ham,hi darlin im way london smashed another driver big dent im really missing u u xxx
ham,white fudge oreo store
ham,bruce b down amp fletcher
ham,wishing family merry x ma happy new year advance
ham,head straight
ham,u got person story
ham,lol grr mom taking forever prescription pharmacy like 2 minute away ugh
ham,hello wats talk email address
ham,honey sweetheart darling sexy bun sugar plum loverboy miss boytoy smack as go gym
ham,said u mind go bedroom minute ok sed sexy mood came 5 minuts latr wid caken wife
ham,wow youre right didnt mean guess gave boston men changed search location nyc something changed cuz signin page still say boston
ham,yeah work fine started last week stuff dull easy guy fun
ham,im actor work work evening sleep late since im unemployed moment always sleep late youre unemployed every day saturday
ham,evry emotion dsnt hav wordsevry wish dsnt hav prayrs u smiled world wit uothrwise even drop tear dsnt lik 2 stay wit uso b happy good morning keep smiling
spam,guaranteed £1000 cash £2000 prize claim yr prize call customer service representative 08714712412 10am7pm cost 10p
ham,joining today formallypls keep prayingwill talk later
spam,gent trying contact last weekend draw show £1000 prize guaranteed call 09064012160 claim code k52 valid 12hrs 150ppm
ham,great getting worried know wonderful caring person like best life know u r wonderful god love
ham,stayin trouble strangersaw dave day hes sorted nowstill bloke u gona get girl mrur mum still think get 2getha
ham,cheer callin babesozi culdnt talkbut wannatell u detail later wenwecan chat properly x
ham,raviyog peripheral bhayandar east
ham,idea soon get converted live
spam,win winner mr foley ipod exciting prize soon keep eye ur mobile visit wwwwin82050couk
spam,want latest video handset 750 anytime network min half price line rental reply call 08000930705 delivery tomorrow
ham,heard week
ham,id say thats good sign well know track record reading woman
ham,havent left yet probably gon na til dinner
ham,sicomo nolistened2the plaid albumquite gdthe new air1 hilariousalso boughtbraindancea compofstuff aphexs abelu hav2hear itc u sn xxxx
ham,yo dude guess got arrested day
ham,ummmmmaah many many happy return day dear sweet heart happy birthday dear
ham,fine remember
ham,castor need see something
ham,ok im gon na head usf like fifteen minute
ham,dont anybodys number still havent thought tactful way ask alex
ham,watching cartoon listening music amp eve go temple amp church u
ham,hope youve settled new school year wishin gr8 day
ham,sorry sir call tomorrow senthilhsbc
ham,im way home went change batt 4 watch go shop bit lor
ham,deep sigh miss really surprised havent gone net cafe yet get dont miss
ham,pete please ring meive hardly gotany credit
ham,im eatin lor goin back work soon e mountain deer show huh watch b4 liao nice
ham,call u finish come n pick u
ham,aiyo co sm ü ü neva reply wait 4 ü reply lar tot ü havent finish ur lab wat
ham,good afternon love today hope good maybe interview wake miss babe passionate kiss across sea
ham,guy asking get slipper gone last year
ham,lol busy
ham,men always need beautiful intelligent caring loving adjustable cooperative wife law allows one wife
ham,cthen thk shd b enuff still got conclusion n content pg n reference ill b da content pg n cover pg
ham,wan na art
ham,hey leave big deal take care
spam,free 1st week no1 nokia tone 4 ur mob every week txt nokia 8007 get txting tell ur mate wwwgetzedcouk pobox 36504 w45wq norm150ptone 16
ham,many dependent
ham,im solihull want anything
ham,need ke qi ü bored izzit suddenly thk
ham,tell something thats okay
ham,woke yeesh late didnt fall asleep til ltgt
spam,datingi two started sent text talk sport radio last week connection think coincidence
ham,eat old airport road 630 oredi got lot pple
ham,usually body take care buy making sure doesnt progress pls continue talk saturday
ham,bookedthe hut also time way
ham,got lousy sleep kept waking every 2 hour see cat wanted come worry cold
ham,love know feel make belly warm wish love shall meet dream ahmad adoring kiss
spam,valued vodafone customer computer picked win £150 prize collect easy call 09061743386
ham,ok tell half hr b4 u come need 2 prepare
ham,ü come
ham,dont plan staying night prolly wont back til late
ham,haf msn yijuehotmailcom
ham,hi darlin youphone im athome youwanna chat
ham,happen
ham,dont worry 1 day big lambu ji vl cometil enjoy batchlor party
ham,ltgt buck bank fee fixed better call bank find
ham,im good movie ok leave hourish
ham,met stranger choose friend long world stand friendship never end let friend forever gud nitz
ham,ok least armands still around
ham,hi princess thank pic pretty
ham,nothis kallis home groundamla home town durban
ham,oh k come tomorrow
ham,get class bsn like ltgt minute know advising
ham,good day toopray meremove teeth painful maintaining stuff
ham,pain couldnt come worse time
ham,lost 4 pound since doc visit last week woot woot im gon na celebrate stuffing face
ham,checking
ham,lunch come quickly open door
ham,want bold 2 bb torch
ham,dont shall buy one dear
ham,great send account number
ham,umma life vava umma love lot dear
spam,congrats 2 mobile 3g videophones r call 09063458130 videochat wid ur mate play java game dload polyph music noline rentl bx420 ip4 5we 150p
ham,yes im small kid boost secret energy
ham,long beach lor expected u dinner
ham,frnd juz wordnot merely relationshipits silent promise say wherevr whenevr forevr gudnyt dear
ham,hope know im still mad
ham,im great aunt anniversary party tarpon spring
spam,taking part mobile survey yesterday 500 text 2 use however wish 2 get txts send txt 80160 tc wwwtxt43com 150p
ham,ask keep one maybe thats didnt get message sent glo
ham,u gd lor go shopping got stuff u wan 2 watch infernal affair come lar
ham,get cash together ill text jason
ham,eh ur laptop got stock lei say mon muz come take look c got
ham,hope thing went well doctor reminds still need 2godid u c little thing left lounge
ham,dad wanted talk apartment got late start omw
ham,‘ look frying pan case ‘ cheap book perhaps ‘ silly frying pan ‘ likely book
ham,wuld without baby thought alone mite break dont wan na go crazy everyboy need lady xxxxxxxx
spam,free 1st week entry 2 textpod 4 chance 2 win 40gb ipod £250 cash every wk txt vpod 81303 tscs wwwtextpodnet custcare 08712405020
ham,say fantastic chance anything need bigger life lift losing 2 live think would first person 2 die n v q
ham,lol would awesome payback
ham,mark work tomorrow get 5 work house meet u afterwards
ham,hai dear friend new amp present number rajitha raj ranju
ham,accidentally deleted message resend please
ham,excellent thought misundrstud frnd knw u hate bt day wen ull knw truth ull hate urself gn
ham,dunno jus say go lido time 930
ham,let ur heart ur compass ur mind ur map ur soul ur guide u never loose worldgnun sent via way2smscom
ham,v nice 2 sheffield tom 2 air opinion category 2 b used 2 measure ethnicity next census busy transcribing
ham,want snow freezing windy
ham,bluray player
ham,sure since parent working tuesday dont really need cover story
ham,ok lor
ham,ü ready call
ham,okie
ham,dont talk ever ok word
ham,xam hall boy asked girl tell starting term dis answer den manage lot hesitation n lookin around silently said intha ponnungale ipaditan
ham,okie
spam,spook mob halloween collection logo pic message plus free eerie tone txt card spook 8007 zed 08701417012150p per logopic
ham,dad back ph
ham,dont let studying stress l8r
ham,rose redred bloodblood heartheart u u send ti ur friend including u like u get back 1u r poor relation 2u need 1 support 3u r frnd 2 many 4some1 luvs u 5 some1 praying god marry u try
spam,realize 40 year well thousand old lady running around tattoo
ham,hey gave photo registered driving ah tmr wan na meet yck
ham,try making another butt
ham,im late tellmiss im way
ham,didnt try g decided head
spam,awarded sipix digital camera call 09061221061 landline delivery within 28days c box177 m221bp 2yr warranty 150ppm 16 p p£399
spam,kit strip billed 150p netcollex ltd po box 1013 ig11 oja
ham,oh ok wait 4 lect havent finish
ham,shb b ok lor thanx
ham,way office da
spam,win winner mr foley ipod exciting prize soon keep eye ur mobile visit wwwwin82050couk
ham,really crashed cuddled sofa
ham,hit move
ham,well might come
ham,ha ha cool cool chikku chikkudb
spam,stop club tone replying stop mix see mytonecomenjoy html term club tone cost gbp450week mfl po box 1146 mk45 2wt 23
spam,free msgwe billed mobile number mistake shortcode 83332please call 08081263000 charge refundedthis call free bt landline
ham,k give sec breaking ltgt cstore
ham,know wot people wear shirt jumper hat belt know r cribbs
ham,thank meet monday
spam,sm auction brand new nokia 7250 4 auction today auction free 2 join take part txt nokia 86021
ham,reckon need town eightish walk carpark
ham,go n buy juz buy get lar
ham,yup
ham,frndship like needle clock though v r clock v r nt able 2 met evn v meetitz 4few second bt v alwys stay conected gud 9t
ham,todaysundaysunday holidayso work
ham,im gon na able late notice ill home week anyway plan
ham,hey babe far 2 spunout 2 spk da mo dead 2 da wrld sleeping da sofa day cool nytho tx 4 fonin hon call 2mwen im bk frmcloud 9 j x
ham,left dessert u wan 2 go suntec look 4 u
ham,sir waiting mail
ham,call
ham,rushing im working im school rush go hungry
ham,hi finally completed course
ham,yahoo boy bring perf legal
ham,new address applespairsall malarky
ham,two letter copy co one message speak soon
ham,ok ur typical reply
ham,oh great ill disturb talk
ham,yes thats u texted pshewmissing much
ham,sorry sent blank msg yup trying 2 serious studying
ham,r many modelsony ericson also der ltgt luks good bt forgot modl
ham,housemaid murderer coz man murdered ltgt th january public holiday govtinstituitions closedincluding post officeunderstand
ham,waiting 4 tv show 2 start lor u leh still busy ur report
ham,oh well c u later
ham,u attend ur driving lesson many time wk n day
ham,ugh hopefully asus ppl dont randomly reformat
spam,urgent ur awarded complimentary trip eurodisinc trav acoentry41 £1000 claim txt dis 87121 186£150morefrmmob shracomorsglsuplt10 ls1 3aj
ham,okie ü wan meet bishan co bishan im driving today
ham,da happy sit together na
ham,sorry pa dont knw ru pa
ham,tirupur call da
ham,special
ham,sorry got late start way
ham,supervisor find 4 one lor thk student havent ask yet tell u aft ask
ham,ok wont call disturb one know avoiding burden
ham,running managed 5 minute needed oxygen might resort roller option
ham,thinked first time saw class
ham,ok asked money far
ham,finish liao u
ham,lol happens vega stay vega
ham,nice waitshould texting right im gon na pay ticket ya know
ham,went pay rent go bank authorise payment
ham,nothing splwat abt u whr ru
ham,nice pub near frankie n benny near warner cinema
ham,im bus love
ham,finished lunch already u wake already
ham,goodmorning today late ltdecimalgt min
ham,normally hot mail com see
ham,going write ccna exam week
ham,sound like something someone testing would sayy
ham,hey late im amk need drink tea coffee
ham,ywhere u dogbreath sounding like jan c thats al
ham,becoz ltgt jan whn al post ofice holiday cn go fr post oficegot duffer
ham,started searching get job dayshe great potential talent
ham,plz tell an bslvyl sent via fullonsmscom
ham,number sir
ham,night worrying appt shame missed girl night quiz popcorn hair
spam,ringtone club gr8 new polys direct mobile every week
ham,creep
ham,oh get paid outstanding one commercial hasbroin august made u jump many hoop get paid still
ham,‘ thing ape u fight death keep something minute u let go thats
ham,im saying havent explicitly told nora know someone im probably gon na bother
ham,back bit long co accident a30 divert via wadebridgei brilliant weekend thanks speak soon lot love
ham,could ask carlos could get anybody else chip
ham,willing go apps class
ham,tagged friend seemed count friend
ham,coming friday leave pongaldo get news work place
ham,alreadysabarish asked go
ham,ill see prolly yeah
ham,see cup coffee animation
ham,u think girl propose u today seing ur bloody funky shit fucking faceasssssholeeee
spam,weekly coolmob tone ready download week new tone include 1 crazy frogaxel f 2 akonlonely 3 black eyeddont p info n
ham,need get
ham,hai priya right doctor said pa
ham,santha num corrct dane
ham,thats one issue california okay snow manageable
ham,well pay like ltgt yr difficult
ham,creepy crazy
ham,yo yo yo byatch whassup
ham,still customer place
ham,hello r u im bored inever thought id get bored tv tell something exciting happened anything
spam,urgent call 09066649731from landline complimentary 4 ibiza holiday £10000 cash await collection sae tc po box 434 sk3 8wp 150ppm 18
ham,think could stop like hour roommate looking stock trip
ham,clothes jewelry trip
ham,wheres boytoy miss happened
ham,da vijay going talk jaya tv
ham,use foreign stamp country good lecture
ham,actually im waiting 2 week start putting ad
ham,yes please leave ltgt ltgt leave
spam,okmail dear dave final notice collect 4 tenerife holiday 5000 cash award call 09061743806 landline tc sae box326 cw25wx 150ppm
ham,send naughty pix
ham,said right giggle saw u would possibly first person2die nvq think much could
ham,nosy guess idk reacting im freaked
ham,hi jess dont know work call u im home eve xxx
ham,height confidence aeronautics professor wer calld amp wer askd 2 sit aeroplane aftr sat wer told dat plane w made student dey hurried plane bt 1 didnt move saidif made studentsthis wont even start datz confidence
ham,sell well ton coin sell coin someone thru paypal voila money back life pocket
ham,
spam,win year supply cd 4 store ur choice worth £500 enter £100 weekly draw txt music 87066 tscs wwwldewcomsubs161win150ppmx3
ham,jay want work first hows 4 sound
ham,weightloss girl friend make load money ebay something give thanks god
ham,hope alright babe worry might felt bit desparate learned job fake waiting come back love
spam,urgent ur awarded complimentary trip eurodisinc trav acoentry41 £1000 claim txt dis 87121 186£150morefrmmob shracomorsglsuplt10 ls1 3aj
spam,heard u4 call 4 rude chat private line 01223585334 cum wan 2c pic gettin shagged text pix 8552 2end send stop 8552 sam xxx
ham,oh kkwhere take test
ham,im meeting call later
ham,ok sure time tho sure get library class try see point good eve
ham,ready big day tomorrow
ham,wat r u
spam,sex ur mobile free sexy pic jordan text babe 88600 every wk get sexy celeb pocketbabecouk 4 pic 16 £3wk 087016248
spam,1 new message call 02070836089
ham,got message ignoring yes shopping
ham,hmm ok ill stay like hour co eye really sore
ham,wana plan trip sometme
ham,babe go day miss already love loving kiss hope everything go well
ham,lol dont know awesome phone could click delete right want
ham,thats significant dont worry
ham,thank baby cant wait taste real thing
ham,want inside every night
ham,boo im way mom shes making tortilla soup yummmm
ham,nt driving even many reason called bbdthts chikku hw abt dvg coldheard tht vinobanagar violence hw conditionand hw ru problem
ham,fuck babe miss already know cant let send money towards net need want crave
ham,engalnd telly decided wont let watch mia elliot kissing damn
ham,luv u soo much u dont understand special u r 2 ring u 2morrow luv u xxx
ham,dont message offer
spam,claire havin borin time alone u wan na cum 2nite chat 09099725823 hope 2 c u luv claire xx calls£1minmoremobsemspobox45po139wa
ham,sorry man account dry would want could trade back half could buy shit credit card
ham,computer fried essential part dont keep spare fucking idiot roommate looovvve leaving thing running full ltgt 7
spam,1 new voicemail please call 08719181513
spam,urgent trying contact u today draw show £800 prize guaranteed call 09050003091 land line claim c52 valid 12hrs
ham,1 finish meeting call
ham,1 tension face 2 smiling face 3 waste face 4 innocent face 5terror face 6cruel face 7romantic face 8lovable face 9decent face ltgt joker face
spam,selected stay 1 250 top british hotel nothing holiday worth £350 claim call london 02072069400 bx 526 sw73ss
ham,wat ü
ham,cuz ibored wan na study
ham,ummmmmaah many many happy return day dear sweet heart happy birthday dear
ham,ok lar double check wif da hair dresser already said wun cut v short said cut look nice
