label,message
ham,hello hows saturday go texting see youd decided anything tomo im trying invite anything
ham,arrived see couple day lt3
ham,lost 10 kilo today
ham,sure ill see come bit
ham,got ta
ham,hi babe u r likely bed im sorry tonight really wan na see u tomorrow call 9 love xxx
ham,hi spoke maneesha v wed like know satisfied experience reply toll free yes
ham,night sweet sleep well ive see exorcism emily rose may never sleep hug snogs
ham,make sure alex know birthday fifteen minute far youre concerned
spam,collect valentine weekend paris inc flight hotel £200 prize guaranteed text paris 69101 wwwrtfsphostingcom
spam,ur chance win £250 cash every wk txt play 83370 tscs wwwmusictrivianet custcare 08715705022 1x150pwk
ham,even u dont get trouble convincingjust tel twice tel neglect msg dont c read itjust dont reply
spam,people dogging area call 09090204448 join like minded guy arrange 1 there 1 evening a£150 minapn ls278bb
ham,ü still got lesson ü sch
ham,u still havent got urself jacket ah
spam,private 2004 account statement 07742676969 show 786 unredeemed bonus point claim call 08719180248 identifier code 45239 expires
ham,otherwise part time job natuition
ham,see
ham,hey mr going sea view couple gay mean game give bell ya finish
ham,heart empty without love mind empty without wisdom eye r empty without dream amp life empty without frnds alwys touch good night amp sweet dream
ham,thought slide enough
ham,ok
ham,kinda first one get twelve aah speak tomo
ham,evo download flash jealous
ham,like spoiled
ham,actually deleted old websitenow blogging magicalsongsblogspotcom
ham,smile pleasure smile pain smile trouble pours like rain smile sum1 hurt u smile becoz someone still love see u smiling
ham,pick drop carso problem
ham,babe love cover face kiss
ham,daddy take good care
ham,time fix spelling sometimes get completely diff word go figure
ham,heygreat dealfarm tour 9am 5pm 95pax 50 deposit 16 may
ham,lmaonice 1
ham,ok wun b angry msg u aft come home tonight
ham,mostly sport typelyk footblcrckt
ham,oh really make air whats talent
ham,nt joking seriously told
spam,free message activate 500 free text message replying message word free term condition visit www07781482378com
spam,winner valued network customer selected receivea £900 prize reward claim call 09061701461 claim code kl341 valid 12 hour
ham,aight lem know whats
ham,wat uniform get
ham,waiting call sir
ham,infact happy new year seeing
ham,hey time driving fri go evaluation fri
ham,kkcongratulation
ham,mystery solved opened email he sent another batch isnt sweetie
spam,want new video phone 600 anytime network min 400 inclusive video call downloads 5 per week free deltomorrow call 08002888812 reply
ham,yes innocent fun
ham,well done luv ya
ham,sure whenever show fuck gt
ham,samus shoulder yet
ham,wont wats wit guy
ham,height confidence aeronautics professor wer calld amp wer askd 2 sit aeroplane aftr sat wer told dat plane w made student dey hurried plane bt 1 didnt move saidif made studentsthis wont even start datz confidence
ham,dont gim lip caveboy
ham,update face book status frequently
ham,lasting much 2 hour might get lucky
spam,new tone week include 1mcflyall ab 2 sara jorgeshock 3 smithswitch order follow instruction next message
ham,r e meeting tmr
ham,sure night menu know noon menu
ham,cooked rather nice salmon la
ham,4 oclock mine bash flat plan
ham,love give massage use lot baby oil fave position
ham,sure neighbor didnt pick
ham,sir hope day going smoothly really hoped wont bother bill cant settle month extra cash know challenging time also let know
ham,sorry ill call later
ham,thank god bed
ham,guy flash go call call madam take care oh
ham,twenty past five said train durham already coz reserved seat
ham,seems unnecessarily affectionate
ham,nohe joined today
ham,even friend priest call
ham,beautiful tomorrow never come come already today hunt beautiful tomorrow dont waste wonderful today goodmorning
ham,enjoy ur life good night
spam,httptms widelivecomindex wmlid820554ad0a1705572711firsttrue¡c c ringtone¡
spam,free nokia motorola upto 12mths 12price linerental 500 free xnet mins100txtmth free btooth call mobileupd8 08001950382 call 2optoutd3wv
ham,whats room number wan na make sure im knocking right door
ham,ill text creepy like wont think forgot
ham,yeah probably
ham,keep ten r shelf buy two egg
ham,alright thanks advice enjoy night ima try get sleep
ham,really hows master
ham,need buy lunch eat maggi mee
ham,spoil bed well
spam,panasonic bluetoothhdset free nokia free motorola free doublemins doubletxt orange contract call mobileupd8 08000839402 call 2optout
ham,ure welcome caught u using broken english
spam,urgent trying contact u today draw show £800 prize guaranteed call 09050000460 land line claim j89 po box245c2150pm
ham,film ill call later
ham,u konw waht rael friendship im gving yuo exmpel jsut ese tihs msg evrey splleing tihs msg wrnog bt sitll yuo raed wihtuot ayn mitsake goodnight amp nice sleepsweet dream
ham,damn make tonight want wait til tomorrow
ham,dont file bagi work called mei tell find anything room
ham,gr8 see message r u leaving congrats dear school wat r ur plan
ham,dont put phone silent mode ok
ham,2 sleeping bag 1 blanket paper phone detail anything else
ham,cool tyler take gon na buy drop place later tonight total order quarter got enough
spam,important customer service announcement call freephone 0800 542 0825
ham,love aathilove u lot
ham,ü neva tell noe im home da aft wat
ham,armand say get as epsilon
ham,would u fuckin believe didnt know thurs pre booked cancelled need b sacked
ham,dont knw pa drink milk
spam,want new nokia 3510i colour phone deliveredtomorrow 300 free minute mobile 100 free text free camcorder reply call 08000930705
ham,drug able eat
spam,hi 07734396839 ibh customer loyalty offer new nokia6600 mobile £10 txtauctiontxt wordstart no81151 get now4t
ham,night ended another day morning come special way may smile like sunny ray leaf worry blue blue bay
ham,reach ur home ltgt minute
spam,great news call freefone 08006344447 claim guaranteed £1000 cash £2000 gift speak live operator
ham,u lunch alone bored
ham,board working fine issue overheating also reslove still software inst pending come around 8o clock
ham,friendship poem dear dear u r near hear dont get fear live cheer tear u r always dear gud ni8
spam,2nd time tried contact u u £400 prize 2 claim easy call 087104711148 10p per minute btnationalrate
ham,someone smoke every time ive smoked last two week calling texting wanted smoke
ham,ok
ham,movie theatre go watch unlimited movie pay
spam,please call customer service representative 0800 169 6031 10am9pm guaranteed £1000 cash £5000 prize
ham,kkthis month kotees birthday know
ham,dont thnk wrong calling u
ham,got xmas radio time get
spam,ou guaranteed latest nokia phone 40gb ipod mp3 player £500 prize txt word collect 83355 ibhltd ldnw15h 150pmtmsgrcvd18
ham,ok lor wat time ü finish
spam,u ’ bin awarded £50 play 4 instant cash call 08715203028 claim every 9th player win min £50£500 optout 08718727870
ham,shes good wondering wont say hi shes smiling coping long distance
ham,aiyar hard 2 type u later free tell call n scold n tell u
ham,yup bathe liao
ham,mind blastin tsunami occur rajnikant stopped swimming indian oceand
ham,long quit get like 5 minute day
spam,dont b floppy b snappy happy gay chat service photo upload call 08718730666 10pmin 2 stop text call 08712460324
ham,dude fakemy frnds got money thts im reffering uif u member wit mail link u vl credited ltgt r il getiing ltgt rsi draw acc wen ltgt r
ham,though shd go n fun bar town something – sound ok
spam,orange customer may claim free camera phone upgrade loyalty call 0207 153 9996 offer end 14thmarch tc apply optout availa
ham,night night see tomorrow
ham,good afternoon love go day woke early online waiting hmmm italian boy online see grin
ham,way make sure u get train worc foregate street shrub hill fun night x
ham,umma say anything
ham,happy new year melody
ham,si lor juz watched italian job
ham,hey project started aha da
ham,went attend another two round todaybut still didt reach home
spam,guaranteed latest nokia phone 40gb ipod mp3 player £500 prize txt word collect 83355 ibhltd ldnw15h 150pmtmsgrcvd18
ham,u sick still go shopping
spam,romcapspam everyone around responding well presence since warm outgoing bringing real breath sunshine
ham,okay well thanks clarification
spam,hear new divorce barbie come ken stuff
ham,shall call dear food
ham,sorry flaked last night shit seriously goin roommate tonight
ham,know hows anthony bringing money ive school fee pay rent stuff like thats need help friend need
ham,fighting world easy u either win lose bt fightng some1 close u dificult u lose u lose u win u still lose
ham,japanese proverb one u none itu must indian version one let none itleave finally kerala version one stop none make strike
spam,natalie 20f inviting friend reply yes165 no165 see wwwsmsacunatalie2k9 stop send stop frnd 62468
ham,huh hyde park mel ah opps got confused anyway tt e best choice den juz take
ham,got hella gas money want go grand nature adventure galileo little bit
ham,drive read need write
ham,cramp stopped going back sleep
ham,bought test yesterday something let know exact day u ovulatewhen get 2u 2 3wks pls pls dont fret know u r worried pls relax also anything ur past history u need tell
ham,ups 3days also shipping company take 2wks way usps take week get lag may bribe nipost get stuff
ham,sorry ill call later
ham,good day
ham,nope thats fine might nap tho
ham,friend want drive em someplace probably take
spam,thanks 4 continued support question week enter u in2 draw 4 £100 cash name new u president txt an 80082
ham,got seventeen pound seven hundred ml – hope ok
ham,see christmassy
ham,ü go buy wif meet ü later
ham,turn friend staying whole show wont back til ltgt feel free go ahead smoke ltgt worth
ham,hope good week checking
ham,regret inform u nh made mistakeu never actually bornplease report 2 yor local hospital 2b terminatedwe r sorry 4 inconvenience
ham,nvm ok
spam,chance win free bluetooth headset simply reply back adp
ham,idea guess well work hour supposed leave since usual nobody interest figuring shit last second
ham,friendship poem dear dear u r near hear dont get fear live cheer tear u r always dear gud ni8
ham,thanx 4 e brownie v nice
ham,shes find sent offline message know anjolas
ham,always make thing bigger
ham,yeah thats impression got
ham,yet chikkuk wat abt tht guy stopped irritating msging u
ham,lol ok forgiven
ham,yo im right yo work
ham,pls wont belive godnot jesus
ham,make girl happy difficult make girl happy u need 1 friend 2 companion 3 lover 4 chef ltgt good listener ltgt organizer ltgt good boyfriend ltgt clean ltgt sympathetic ltgt athletic ltgt warm ltgt courageous ltgt determined ltgt true ltgt dependable ltgt intelligent ltgt psychologist ltgt pest exterminator ltgt psychiatrist ltgt healer ltgt stylist ltgt driver aaniye pudunga venaam
spam,urgent important information 02 user today lucky day 2 find log onto httpwwwurawinnercom fantastic surprise awaiting
ham,tell happen dont behave like ok need say
ham,taking italian food pretty dress panty
ham,oh send address
ham,yep fine 730 830 ice age
spam,dorothykiefercom bank granite issue strongbuy explosive pick member 300 nasdaq symbol cdgt 500 per
spam,3 free tarot text find love life try 3 free text chance 85555 16 3 free msg £150
ham,kkhow business
ham,mah b ill pick tomorrow
ham,could work well reach consensus next meeting
ham,eat shit wait ur monkey face bitch u asshole
ham,guai ü shd haf seen he naughty ü free today go jogging
ham,probably wont eat today think im gon na pop weekend u miss
ham,cant keep going never intention run choose rather keep room clean dont say visitor maybe thats best choice yes wanted embarassed maybe youd feel feel friend want drop buy say happened morning ive tried everything dont know else
ham,cheer message zogtorius ive staring phone age deciding whether text
ham,come tomorrow di
ham,okay lor wah like def wont let u go haha say term condition
ham,‘ parked next mini coming today think
spam,cd 4u congratulation ur awarded £500 cd gift voucher £125 gift guaranteed freeentry 2 £100 wkly draw xt music 87066 tncs wwwldewcom1win150ppmx3age16
spam,text pas 69669 collect polyphonic ringtones normal gprs charge apply enjoy tone
ham,thats cool liked photo sexy
ham,battery mr adewale uncle aka egbon
ham,yeah lol luckily didnt starring role like
spam,sunshine quiz wkly q win top sony dvd player u know country liverpool played mid week txt ansr 82277 £150 sptyrone
ham,nope im going home go pump petrol lor like going 2 rain soon
ham,kkgoodstudy well
ham,usualiam fine happy amp well
ham,sorry ill call later
ham,many company tell language
ham,thinking chuckin ur red green n black trainners 2 save carryin bac train
ham,howz person story
ham,going take bath ill place key window
ham,yup leaving right back soon
spam,youve tkts euro2004 cup final £800 cash collect call 09058099801 b4190604 pobox 7876150ppm
ham,hi hope u get txtjourney hasnt gdnow 50 min late think
ham,hi email address changed
ham,called said himthen choose future
ham,apo mokka player
ham,amazing rearrange letter give meaning dormitory dirty room astronomer moon starer eye see election result lie let recount motherinlaw woman hitler eleven plus two twelve plus one amazing
ham,yeshe good crickiting mind
ham,ok
ham,madamregret disturbancemight receive reference check dlf premaricakindly informedrgdsrakheshkerala
ham,8 latest g still scrounge ammo want give new ak try
spam,hot live fantasy call 08707500020 20p per min ntt ltd po box 1327 croydon cr9 5wb 0870 national rate call
ham,fyi im gon na call sporadically starting like ltgt bc doin shit
ham,im inperialmusic listening2the weirdest track ever byleafcutter johnsounds like insect molestedsomeone plumbingremixed evil men acid
ham,eh u send wrongly lar
ham,hey going lo lesson gym
ham,let math good
ham,hi yijue regarding 3230 textbook intro algorithm second edition im selling 50
spam,camera awarded sipix digital camera call 09061221066 fromm landline delivery within 28 day
ham,finish already yar keep saying mushy embarrassed ok
spam,unique user id 1172 removal send stop 87239 customer service 08708034412
spam,2004 account 07xxxxxxxxx show 786 unredeemed point claim call 08719181259 identifier code xxxxx expires 260305
ham,boo hows thing im back home little bored already
ham,call youcarlos isare phone vibrate acting might hear text
ham,per request maangalyam alaipayuthe set callertune caller press 9 copy friend callertune
ham,good morning boytoy hows yummy lip wheres sexy bun think crave need
ham,know hook mean right
ham,big chic common declare
ham,sorry ill call later
ham,geeeee love much barely stand
ham,god created gap btwn ur finger dat sum1 vry special fill gap holding ur hand plz dont ask created much gap leg
ham,watching tv lor funny bluff 4 wat izzit thk impossible u
ham,u find time bus coz need sort stuff
spam,recpt 13 ordered ringtone order processed
spam,gent trying contact last weekend draw show £1000 prize guaranteed call 09064012160 claim code k52 valid 12hrs 150ppm
ham,msg rajini come
ham,alex say he ok ok
ham,good stuff
ham,storming msg wen u lift phne u say hello u knw wt real meaning hello name girl yes u knw dat girl margaret hello girlfrnd f grahmbell invnted telphone moralone 4get name person bt girlfrnd g n g h
ham,impossible argue always treat like sub like never released remind necessary
spam,complimentary 4 star ibiza holiday £10000 cash need urgent collection 09066364349 landline lose box434sk38wp150ppm18
ham,asked sen come chennai search job
ham,1appledayno doctor 1tulsi leafdayno cancer 1lemondayno fat 1cup milkdayno bone problms 3 litre watrdayno disease snd th 2 u care
ham,haha awesome minute
ham,tomarrow want got court ltdecimalgt come bus stand 9
ham,come ur home
spam,reply name address receive post week completely free accommodation various global location wwwphb1com ph08700435505150p
ham,boy sweet word left morning sigh go day love start studying
ham,nojst change tat
ham,ok cool see ya
ham,sen told going join uncle finance cbe
ham,playng 9 door game gt racing phone lol
ham,going nothing greatbye
ham,cant pick phone right pls send message
spam,hmv bonus special 500 pound genuine hmv voucher answer 4 easy question play send hmv 86688 infowww100percentrealcom
ham,dear good morning
ham,tell quite long co havent finish film yet
ham,love isnt decision feeling could decide love life would much simpler less magical
ham,pls pls drink plenty plenty water
ham,sorry completely forgot pop em round week still
ham,made eta taunton 1230 planned hope ‘ still okday good see xx
ham,ltgt min stop somewhere first
ham,anything lor coming
spam,want new video phone 750 anytime network min half price line rental free text 3 month reply call 08000930705 free delivery
ham,hmm shall bring bottle wine keep u amused joking ill still bring bottle red white see tomorrow
spam,dont forget place many free request 1stchoicecouk wish information call 08707808226
ham,going ride bike
spam,congratulation youve youre winner august £1000 prize draw call 09066660100 prize code 2309
ham,heart empty without love mind empty without wisdom eye r empty without dream amp life empty without frnds alwys touch good night amp sweet dream
ham,aight ill get fb couple minute
ham,cant take major role community outreach rock mel
ham,hey mate hows u honeydid u ave good holiday gimmi de gossx
ham,ive sent send
ham,work right
ham,feb ltgt love u day send dis ur valued frnds evn 3 come back ull gt married person u luv u ignore dis u lose ur luv 4 evr
spam,freemsg havent replied text im randy sexy female live local luv hear u netcollex ltd 08700621170150p per msg reply stop end
ham,gift trying get throw cliff something
ham,call time job today ok umma ask speed
ham,erm … ill pick 645pm thatll give enough time get park
spam,life never much fun great came made truly special wont forget enjoy one gbpsms
ham,hi mobile ltgt added contact list wwwfullonsmscom great place send free sm people visit fullonsmscom
ham,look fuckin time fuck think
ham,okey doke im home dressed co laying around ill speak later bout time stuff
ham,getting anywhere damn job hunting
spam,pls stop bootydelious 32f inviting friend reply yes434 no434 see wwwsmsacubootydelious stop send stop frnd 62468
ham,thanx birthday already
ham,come u got nothing
ham,gal n boy walking park galcan hold ur hand boyy u think would run away galno jst wana c feel walking heaven princegn
ham,fear fainting housework quick cuppa
ham,excellent ready moan scream ecstasy
ham,oops mum somerset bit far back tomo see soon x
spam,winner valued network customer hvae selected receive £900 reward collect call 09061701444 valid 24 hour acl03530150pm
ham,come round
ham,ooooooh forgot tell u get yoville phone
ham,nokia phone lovly
ham,strange watching 2nd one im bed sweet dream miss u
ham,eh u remember 2 spell name yes v naughty make v wet
ham,there someone year ltgt toyota camry like mr olayiwolas mileage ltgt kit clean need know much sell raise dough soon landing sell holla back
spam,dear uve invited xchat final attempt contact u txt chat 86688 150pmsgrcvdhgsuite3422landsroww1j6hl ldn 18 yr
ham,oh ho first time u use type word
ham,hi dude hw r u da realy mising u today
ham,whatsup dont u want sleep
spam,hot live fantasy call 08707509020 20p per min ntt ltd po box 1327 croydon cr9 5wb 0870k
ham,sorry im getting feel really bad totally rejected kinda thing
ham,hiya hows going sunny africa hope u r avin good time give big old silver back big kiss
ham,fuck cedar key fuck come anyway tho
ham,think sent text home phone cant display text still want send number
ham,youre right think
spam,contacted dating service someone know find call land line 09050000928 pobox45w2tg150p
ham,thats cool hell night lem know youre around
ham,lovely night xxx
ham,ok lor buy wat
ham,probably couple hour top
spam,please call customer service representative freephone 0808 145 4742 9am11pm guaranteed £1000 cash £5000 prize
ham,stand away doesnt heart ache without dont wonder dont crave
ham,ranjith cal drpd deeraj deepak 5min hold
ham,senthil group company apnt 5pm
ham,said would woke
spam,dont know u u dont know send chat 86688 let find 150pmsg rcvd hgsuite3422landsroww1j6hl ldn 18 year
ham,science tell chocolate melt sunlight please dont walk sunlight bcozi dont want loss sweet friend
spam,mobile 10 mths update latest orange cameravideo phone free save £s free textsweekend call text yes callback orno opt
ham,pansy youve living jungle two year driving worried
ham,friend use call
spam,themobyo yo yohere come new selection hot downloads member get free click open next link sent ur fone
ham,hey whats plan sat
ham,darling sister whens school resuming minimum wait period reapply take care
ham,dude sux snake got old raiden got buff
ham,photoshop make computer shut
ham,plm come da way
ham,mm umma ask vava also come tell play later together
ham,prepare pleasured
ham,send email mind ltgt time per night
ham,shes borderline yeah whatever
ham,asked call ok
ham,ltgt mca conform
spam,youve tkts euro2004 cup final £800 cash collect call 09058099801 b4190604 pobox 7876150ppm
ham,im reaching another 2 stop
ham,hi dahow today class
ham,common hearin r u wat r u ur day let ask u something different u smile today gud evng
ham,ok
ham,wait till end march el nino get oh
ham,hey go jazz power yoga hip hop kb yogasana
ham,yep get program youre slacking
ham,dear heroi leaving qatar tonite apt opportunitypls keep touch ltemailgt kerala
ham,safe trip nigeria wish happiness soon company share moment
ham,sound like many talent would like go dinner date next week
ham,hi baby ive got back work wanting see u allday hope didnt piss u phone today u give call xxx
ham,oh really perform write paper go movie home midnight huh
ham,cool like swimming pool jacuzzi house
ham,nt yet chikkusimple habbahw abt u
ham,hey doc pls want get nice shirt hubby nice fiting one budget ltgt k help pls load card abi hwkeep posted luv 2 mj
ham,prepare pounded every night
ham,much textin bout
ham,true deari sat pray evening felt soso smsd time
ham,hi baby im sat bloody bus mo wont home 730 wan na somethin later call later ortxt back jess xx
ham,know account detailsi ask mom send youmy mom reach
ham,still looking job much ta earn
ham,said u mind go bedroom minute ok sed sexy mood came 5 minuts latr wid caken wife
ham,call didnt see facebook huh
ham,noi got rumour going buy apartment chennai
spam,great new offer double min double txt best orange tariff get latest camera phone 4 free call mobileupd8 free 08000839402 2stoptxt tc
ham,ask around there lot term mids
ham,yes baby study position kama sutra
ham,doinghow
ham,alright took morphine back yo
ham,glad talking
ham,da birthdate certificate april real date today dont publish shall give special treat keep secret way thanks wish
ham,two team waiting player
spam,8007 25p 4 alfie moon child need song ur mob tell ur m8s txt tone charity 8007 nokias poly charity polys zed 08701417012 profit 2 charity
spam,urgent trying contact u today draw show £2000 prize guaranteed call 09058094507 land line claim 3030 valid 12hrs
ham,u dun drive go 2 sch
ham,lol really need remember eat im drinking appreciate keeping company night babe smile
ham,ü wait 4 bus stop aft ur lect lar dun c ü go get car come back n pick ü
ham,sorry got thing may pub later
ham,also sir sent email log usc payment portal ill send another message explain thing back home great weekend
ham,miss much im desparate recorded message left day listen hear sound voice love
ham,course guess god got hold right
ham,im coming back thursday yay gon na ok get money cheer oh yeah everything alright hows school call work
ham,er hello thing ‘ quite go plan – limping slowly home followed aa exhaust hanging
spam,thanks ringtone order ref number r836 mobile charged £450 tone arrive please call customer service 09065069154
ham,started dont stop pray good idea anything see help guy ill forward link
ham,actually mobile full msg work online need send ltgt sent msg wil explain u later
ham,im gon na say sorry would normal starting panic time sorry seeing tuesday
spam,record indicate u maybe entitled 5000 pound compensation accident claim 4 free reply claim msg 2 stop txt stop
ham,never nothing
ham,japanese proverb one u none itu must indian version one let none itleave finally kerala version one stop none make strike
ham,ill talk others probably come early tomorrow
ham,thursday night yeah sure thing well work
ham,nice talking please dont forget pix want see
ham,hey guy know breathing neck get bud anyway youd able get half track usf tonight
ham,he really skateboarding despite fact get thrown wind bandage shit arm every five minute
ham,watching house – entertaining – getting whole hugh laurie thing – even stick – indeed especially stick
ham,u havent lost ill always b 4ui didnt intend 2 hurt u never knew u felt iwasmarinethats itried2tell urmomi careabout u
ham,customer place call
ham,idk im sitting stop shop parking lot right bawling eye feel like im failure everything nobody want feel like im failing
ham,feb ltgt love u day send dis ur valued frnds evn 3 come back ull gt married person u luv u ignore dis u lose ur luv 4 evr
ham,havent add ü yet right
ham,christmas occasion celebrated reflection ur value desire affectionsamp tradition ideal christmas
ham,u call alter 11 ok
