message,label
u ’ bin awarded £50 play 4 instant cash call 08715203028 claim every 9th player win min £50£500 optout 08718727870,1
shes good wondering wont say hi shes smiling coping long distance,0
aiyar hard 2 type u later free tell call n scold n tell u,0
yup bathe liao,0
mind blastin tsunami occur rajnikant stopped swimming indian oceand,0
long quit get like 5 minute day,0
dont b floppy b snappy happy gay chat service photo upload call 08718730666 10pmin 2 stop text call 08712460324,1
dude fakemy frnds got money thts im reffering uif u member wit mail link u vl credited ltgt r il getiing ltgt rsi draw acc wen ltgt r,0
though shd go n fun bar town something – sound ok,0
orange customer may claim free camera phone upgrade loyalty call 0207 153 9996 offer end 14thmarch tc apply optout availa,1
night night see tomorrow,0
good afternoon love go day woke early online waiting hmmm italian boy online see grin,0
way make sure u get train worc foregate street shrub hill fun night x,0
umma say anything,0
happy new year melody,0
si lor juz watched italian job,0
hey project started aha da,0
went attend another two round todaybut still didt reach home,0
guaranteed latest nokia phone 40gb ipod mp3 player £500 prize txt word collect 83355 ibhltd ldnw15h 150pmtmsgrcvd18,1
u sick still go shopping,0
romcapspam everyone around responding well presence since warm outgoing bringing real breath sunshine,1
okay well thanks clarification,0
hear new divorce barbie come ken stuff,1
shall call dear food,0
sorry flaked last night shit seriously goin roommate tonight,0
know hows anthony bringing money ive school fee pay rent stuff like thats need help friend need,0
fighting world easy u either win lose bt fightng some1 close u dificult u lose u lose u win u still lose,0
japanese proverb one u none itu must indian version one let none itleave finally kerala version one stop none make strike,0
natalie 20f inviting friend reply yes165 no165 see wwwsmsacunatalie2k9 stop send stop frnd 62468,1
huh hyde park mel ah opps got confused anyway tt e best choice den juz take,0
got hella gas money want go grand nature adventure galileo little bit,0
drive read need write,0
cramp stopped going back sleep,0
bought test yesterday something let know exact day u ovulatewhen get 2u 2 3wks pls pls dont fret know u r worried pls relax also anything ur past history u need tell,0
ups 3days also shipping company take 2wks way usps take week get lag may bribe nipost get stuff,0
sorry ill call later,0
good day,0
nope thats fine might nap tho,0
friend want drive em someplace probably take,0
thanks 4 continued support question week enter u in2 draw 4 £100 cash name new u president txt an 80082,1
got seventeen pound seven hundred ml – hope ok,0
see christmassy,0
ü go buy wif meet ü later,0
turn friend staying whole show wont back til ltgt feel free go ahead smoke ltgt worth,0
hope good week checking,0
regret inform u nh made mistakeu never actually bornplease report 2 yor local hospital 2b terminatedwe r sorry 4 inconvenience,0
nvm ok,0
chance win free bluetooth headset simply reply back adp,1
idea guess well work hour supposed leave since usual nobody interest figuring shit last second,0
friendship poem dear dear u r near hear dont get fear live cheer tear u r always dear gud ni8,0
thanx 4 e brownie v nice,0
shes find sent offline message know anjolas,0
always make thing bigger,0
yeah thats impression got,0
yet chikkuk wat abt tht guy stopped irritating msging u,0
lol ok forgiven,0
yo im right yo work,0
pls wont belive godnot jesus,0
make girl happy difficult make girl happy u need 1 friend 2 companion 3 lover 4 chef ltgt good listener ltgt organizer ltgt good boyfriend ltgt clean ltgt sympathetic ltgt athletic ltgt warm ltgt courageous ltgt determined ltgt true ltgt dependable ltgt intelligent ltgt psychologist ltgt pest exterminator ltgt psychiatrist ltgt healer ltgt stylist ltgt driver aaniye pudunga venaam,0
urgent important information 02 user today lucky day 2 find log onto httpwwwurawinnercom fantastic surprise awaiting,1
tell happen dont behave like ok need say,0
taking italian food pretty dress panty,0
oh send address,0
yep fine 730 830 ice age,0
dorothykiefercom bank granite issue strongbuy explosive pick member 300 nasdaq symbol cdgt 500 per,1
3 free tarot text find love life try 3 free text chance 85555 16 3 free msg £150,1
kkhow business,0
mah b ill pick tomorrow,0
could work well reach consensus next meeting,0
eat shit wait ur monkey face bitch u asshole,0
guai ü shd haf seen he naughty ü free today go jogging,0
probably wont eat today think im gon na pop weekend u miss,0
cant keep going never intention run choose rather keep room clean dont say visitor maybe thats best choice yes wanted embarassed maybe youd feel feel friend want drop buy say happened morning ive tried everything dont know else,0
cheer message zogtorius ive staring phone age deciding whether text,0
come tomorrow di,0
okay lor wah like def wont let u go haha say term condition,0
‘ parked next mini coming today think,0
cd 4u congratulation ur awarded £500 cd gift voucher £125 gift guaranteed freeentry 2 £100 wkly draw xt music 87066 tncs wwwldewcom1win150ppmx3age16,1
text pas 69669 collect polyphonic ringtones normal gprs charge apply enjoy tone,1
thats cool liked photo sexy,0
battery mr adewale uncle aka egbon,0
yeah lol luckily didnt starring role like,0
sunshine quiz wkly q win top sony dvd player u know country liverpool played mid week txt ansr 82277 £150 sptyrone,1
nope im going home go pump petrol lor like going 2 rain soon,0
kkgoodstudy well,0
usualiam fine happy amp well,0
sorry ill call later,0
many company tell language,0
thinking chuckin ur red green n black trainners 2 save carryin bac train,0
howz person story,0
going take bath ill place key window,0
yup leaving right back soon,0
youve tkts euro2004 cup final £800 cash collect call 09058099801 b4190604 pobox 7876150ppm,1
hi hope u get txtjourney hasnt gdnow 50 min late think,0
hi email address changed,0
called said himthen choose future,0
apo mokka player,0
amazing rearrange letter give meaning dormitory dirty room astronomer moon starer eye see election result lie let recount motherinlaw woman hitler eleven plus two twelve plus one amazing,0
yeshe good crickiting mind,0
ok,0
madamregret disturbancemight receive reference check dlf premaricakindly informedrgdsrakheshkerala,0
8 latest g still scrounge ammo want give new ak try,0
hot live fantasy call 08707500020 20p per min ntt ltd po box 1327 croydon cr9 5wb 0870 national rate call,1
fyi im gon na call sporadically starting like ltgt bc doin shit,0
im inperialmusic listening2the weirdest track ever byleafcutter johnsounds like insect molestedsomeone plumbingremixed evil men acid,0
eh u send wrongly lar,0
hey going lo lesson gym,0
let math good,0
hi yijue regarding 3230 textbook intro algorithm second edition im selling 50,0
camera awarded sipix digital camera call 09061221066 fromm landline delivery within 28 day,1
finish already yar keep saying mushy embarrassed ok,0
unique user id 1172 removal send stop 87239 customer service 08708034412,1
2004 account 07xxxxxxxxx show 786 unredeemed point claim call 08719181259 identifier code xxxxx expires 260305,1
boo hows thing im back home little bored already,0
call youcarlos isare phone vibrate acting might hear text,0
per request maangalyam alaipayuthe set callertune caller press 9 copy friend callertune,0
good morning boytoy hows yummy lip wheres sexy bun think crave need,0
know hook mean right,0
big chic common declare,0
sorry ill call later,0
geeeee love much barely stand,0
god created gap btwn ur finger dat sum1 vry special fill gap holding ur hand plz dont ask created much gap leg,0
watching tv lor funny bluff 4 wat izzit thk impossible u,0
u find time bus coz need sort stuff,0
recpt 13 ordered ringtone order processed,1
gent trying contact last weekend draw show £1000 prize guaranteed call 09064012160 claim code k52 valid 12hrs 150ppm,1
msg rajini come,0
alex say he ok ok,0
good stuff,0
storming msg wen u lift phne u say hello u knw wt real meaning hello name girl yes u knw dat girl margaret hello girlfrnd f grahmbell invnted telphone moralone 4get name person bt girlfrnd g n g h,0
impossible argue always treat like sub like never released remind necessary,0
complimentary 4 star ibiza holiday £10000 cash need urgent collection 09066364349 landline lose box434sk38wp150ppm18,1
asked sen come chennai search job,0
1appledayno doctor 1tulsi leafdayno cancer 1lemondayno fat 1cup milkdayno bone problms 3 litre watrdayno disease snd th 2 u care,0
haha awesome minute,0
tomarrow want got court ltdecimalgt come bus stand 9,0
come ur home,0
reply name address receive post week completely free accommodation various global location wwwphb1com ph08700435505150p,1
boy sweet word left morning sigh go day love start studying,0
nojst change tat,0
ok cool see ya,0
sen told going join uncle finance cbe,0
playng 9 door game gt racing phone lol,0
going nothing greatbye,0
cant pick phone right pls send message,0
hmv bonus special 500 pound genuine hmv voucher answer 4 easy question play send hmv 86688 infowww100percentrealcom,1
dear good morning,0
tell quite long co havent finish film yet,0
love isnt decision feeling could decide love life would much simpler less magical,0
pls pls drink plenty plenty water,0
sorry completely forgot pop em round week still,0
made eta taunton 1230 planned hope ‘ still okday good see xx,0
ltgt min stop somewhere first,0
anything lor coming,0
want new video phone 750 anytime network min half price line rental free text 3 month reply call 08000930705 free delivery,1
hmm shall bring bottle wine keep u amused joking ill still bring bottle red white see tomorrow,0
dont forget place many free request 1stchoicecouk wish information call 08707808226,1
going ride bike,0
congratulation youve youre winner august £1000 prize draw call 09066660100 prize code 2309,1
heart empty without love mind empty without wisdom eye r empty without dream amp life empty without frnds alwys touch good night amp sweet dream,0
aight ill get fb couple minute,0
cant take major role community outreach rock mel,0
hey mate hows u honeydid u ave good holiday gimmi de gossx,0
ive sent send,0
work right,0
feb ltgt love u day send dis ur valued frnds evn 3 come back ull gt married person u luv u ignore dis u lose ur luv 4 evr,0
freemsg havent replied text im randy sexy female live local luv hear u netcollex ltd 08700621170150p per msg reply stop end,1
gift trying get throw cliff something,0
call time job today ok umma ask speed,0
erm … ill pick 645pm thatll give enough time get park,0
life never much fun great came made truly special wont forget enjoy one gbpsms,1
hi mobile ltgt added contact list wwwfullonsmscom great place send free sm people visit fullonsmscom,0
look fuckin time fuck think,0
okey doke im home dressed co laying around ill speak later bout time stuff,0
getting anywhere damn job hunting,0
pls stop bootydelious 32f inviting friend reply yes434 no434 see wwwsmsacubootydelious stop send stop frnd 62468,1
thanx birthday already,0
come u got nothing,0
gal n boy walking park galcan hold ur hand boyy u think would run away galno jst wana c feel walking heaven princegn,0
fear fainting housework quick cuppa,0
excellent ready moan scream ecstasy,0
oops mum somerset bit far back tomo see soon x,0
winner valued network customer hvae selected receive £900 reward collect call 09061701444 valid 24 hour acl03530150pm,1
come round,0
ooooooh forgot tell u get yoville phone,0
nokia phone lovly,0
strange watching 2nd one im bed sweet dream miss u,0
eh u remember 2 spell name yes v naughty make v wet,0
there someone year ltgt toyota camry like mr olayiwolas mileage ltgt kit clean need know much sell raise dough soon landing sell holla back,0
dear uve invited xchat final attempt contact u txt chat 86688 150pmsgrcvdhgsuite3422landsroww1j6hl ldn 18 yr,1
oh ho first time u use type word,0
hi dude hw r u da realy mising u today,0
whatsup dont u want sleep,0
hot live fantasy call 08707509020 20p per min ntt ltd po box 1327 croydon cr9 5wb 0870k,1
sorry im getting feel really bad totally rejected kinda thing,0
hiya hows going sunny africa hope u r avin good time give big old silver back big kiss,0
fuck cedar key fuck come anyway tho,0
think sent text home phone cant display text still want send number,0
youre right think,0
contacted dating service someone know find call land line 09050000928 pobox45w2tg150p,1
thats cool hell night lem know youre around,0
lovely night xxx,0
ok lor buy wat,0
probably couple hour top,0
please call customer service representative freephone 0808 145 4742 9am11pm guaranteed £1000 cash £5000 prize,1
stand away doesnt heart ache without dont wonder dont crave,0
ranjith cal drpd deeraj deepak 5min hold,0
senthil group company apnt 5pm,0
said would woke,0
dont know u u dont know send chat 86688 let find 150pmsg rcvd hgsuite3422landsroww1j6hl ldn 18 year,1
science tell chocolate melt sunlight please dont walk sunlight bcozi dont want loss sweet friend,0
mobile 10 mths update latest orange cameravideo phone free save £s free textsweekend call text yes callback orno opt,1
pansy youve living jungle two year driving worried,0
friend use call,0
themobyo yo yohere come new selection hot downloads member get free click open next link sent ur fone,1
hey whats plan sat,0
darling sister whens school resuming minimum wait period reapply take care,0
dude sux snake got old raiden got buff,0
photoshop make computer shut,0
plm come da way,0
mm umma ask vava also come tell play later together,0
prepare pleasured,0
send email mind ltgt time per night,0
shes borderline yeah whatever,0
asked call ok,0
ltgt mca conform,0
youve tkts euro2004 cup final £800 cash collect call 09058099801 b4190604 pobox 7876150ppm,1
im reaching another 2 stop,0
hi dahow today class,0
common hearin r u wat r u ur day let ask u something different u smile today gud evng,0
ok,0
wait till end march el nino get oh,0
hey go jazz power yoga hip hop kb yogasana,0
yep get program youre slacking,0
dear heroi leaving qatar tonite apt opportunitypls keep touch ltemailgt kerala,0
safe trip nigeria wish happiness soon company share moment,0
sound like many talent would like go dinner date next week,0
hi baby ive got back work wanting see u allday hope didnt piss u phone today u give call xxx,0
oh really perform write paper go movie home midnight huh,0
cool like swimming pool jacuzzi house,0
nt yet chikkusimple habbahw abt u,0
hey doc pls want get nice shirt hubby nice fiting one budget ltgt k help pls load card abi hwkeep posted luv 2 mj,0
prepare pounded every night,0
much textin bout,0
true deari sat pray evening felt soso smsd time,0
hi baby im sat bloody bus mo wont home 730 wan na somethin later call later ortxt back jess xx,0
know account detailsi ask mom send youmy mom reach,0
still looking job much ta earn,0
said u mind go bedroom minute ok sed sexy mood came 5 minuts latr wid caken wife,0
call didnt see facebook huh,0
noi got rumour going buy apartment chennai,0
great new offer double min double txt best orange tariff get latest camera phone 4 free call mobileupd8 free 08000839402 2stoptxt tc,1
ask around there lot term mids,0
yes baby study position kama sutra,0
doinghow,0
alright took morphine back yo,0
glad talking,0
da birthdate certificate april real date today dont publish shall give special treat keep secret way thanks wish,0
two team waiting player,0
8007 25p 4 alfie moon child need song ur mob tell ur m8s txt tone charity 8007 nokias poly charity polys zed 08701417012 profit 2 charity,1
urgent trying contact u today draw show £2000 prize guaranteed call 09058094507 land line claim 3030 valid 12hrs,1
u dun drive go 2 sch,0
lol really need remember eat im drinking appreciate keeping company night babe smile,0
ü wait 4 bus stop aft ur lect lar dun c ü go get car come back n pick ü,0
sorry got thing may pub later,0
also sir sent email log usc payment portal ill send another message explain thing back home great weekend,0
miss much im desparate recorded message left day listen hear sound voice love,0
course guess god got hold right,0
im coming back thursday yay gon na ok get money cheer oh yeah everything alright hows school call work,0
er hello thing ‘ quite go plan – limping slowly home followed aa exhaust hanging,0
thanks ringtone order ref number r836 mobile charged £450 tone arrive please call customer service 09065069154,1
started dont stop pray good idea anything see help guy ill forward link,0
actually mobile full msg work online need send ltgt sent msg wil explain u later,0
im gon na say sorry would normal starting panic time sorry seeing tuesday,0
record indicate u maybe entitled 5000 pound compensation accident claim 4 free reply claim msg 2 stop txt stop,1
never nothing,0
japanese proverb one u none itu must indian version one let none itleave finally kerala version one stop none make strike,0
ill talk others probably come early tomorrow,0
thursday night yeah sure thing well work,0
nice talking please dont forget pix want see,0
hey guy know breathing neck get bud anyway youd able get half track usf tonight,0
he really skateboarding despite fact get thrown wind bandage shit arm every five minute,0
watching house – entertaining – getting whole hugh laurie thing – even stick – indeed especially stick,0
u havent lost ill always b 4ui didnt intend 2 hurt u never knew u felt iwasmarinethats itried2tell urmomi careabout u,0
customer place call,0
idk im sitting stop shop parking lot right bawling eye feel like im failure everything nobody want feel like im failing,0
feb ltgt love u day send dis ur valued frnds evn 3 come back ull gt married person u luv u ignore dis u lose ur luv 4 evr,0
havent add ü yet right,0
christmas occasion celebrated reflection ur value desire affectionsamp tradition ideal christmas,0
u call alter 11 ok,0
heard u4 call 4 rude chat private line 01223585334 cum wan 2c pic gettin shagged text pix 8552 2end send stop 8552 sam xxx,1
im tired arguing week week want ill,0
joy father john john name joy father mandan,0
may b approve panalambut post,0
beautiful truth gravity read carefully heart feel light someone feel heavy someone leaf goodmorning,0
piss talking someone realise u point itnow read backwards,0
know mallika sherawat yesterday find lturlgt,0
sac need carry,0
purity friendship two smiling reading forwarded messageits smiling seeing name gud evng musthu,0
come mahal bus stop ltdecimalgt,0
happy baby alright take job hope fine send kiss make smile across sea kiss kiss,0
gr8 poly tone 4 mob direct 2u rply poly title 8007 eg poly breathe1 title crazyin sleepingwith finest ymca getzedcouk pobox365o4w45wq 300p,1
u ned convince tht possible witot hurting feeling main,0
got ltgt,0
literally bed like ltgt hour,0
take care n get well soon,0
oh baby house come dont new picture facebook,0
k fyi x ride early tomorrow morning he crashing place tonight,0
yo around friend mine lookin pick later tonight,0
alright babe justthought id sayhey u doinnearly endof wk offdam nevamindwe 2hook sn uwant m8 lovejen x,0
last chance claim ur £150 worth discount voucher today text shop 85023 savamob offer mobile c savamob pobox84 m263uz £300 sub 16,1
laid airtel line rest,0
im reading text sent meant joke read light,0
dont look back building coat dont want get sick hurry home wear coat gym,0
finally came fix ceiling,0
shop till u drop either 10k 5k £500 cash £100 travel voucher call 09064011000 ntt po box cr01327bt fixedline cost 150ppm mobile vary,1
give u back id proof ltgt r wont allow work come home within day,0
oooh bed ridden ey thinking,0
ok lor,0
started searching get job dayshe great potential talent,0
okies ill go yan jiu skip ard oso go cine den go mrt one blah blah blah,0
cant talk nowi call candont keep calling,0
kyou girl waiting reception ah,0
happy new year princess,0
plan pongal,0
sary need tim bollox hurt lot tol,0
reach 9 telling dont know,0
ok juz receive,0
thank much skyped wit kz sura didnt get pleasure company hope good weve given ultimatum oh countin aburo enjoy message sent day ago,0
sorry ill call later,0
love u 2 babe r u sure everything alrite idiot txt bak girlie,0
sorry guess whenever get hold connection maybe hour two ill text,0
press conference da,0
funeral home audrey dad,0
make cry stuff happens top everything else push edge dont underdtand often cry sorry sorry life,0
dun believe u thk u told,0
jokin lar depends phone father get lor,0
aight ill ask roommate,0
so amount get pls,0
wats ur opinion abt abt character,0
girl stay bed girl doesnt need recovery time id rather pas fun cooped bed,0
long time remember today,0
hey really pretty late want go lesson first join im reaching tp mrt,0
nope meanwhile talk say make greet,0
kgive back thanks,0
today vodafone number ending 4882 selected receive £350 award number match call 09064019014 receive £350 award,1
asked hows anthony dad bf,0
yup ok thanx,0
sure yet still trying get hold,0
ok,0
waiting machan call free,0
wait know wesley town bet hella drug,0
nobody decide eat dad want chinese,0
love,0
yay finally lol missed cinema trip last week,0
mum ask ü buy food home,0
good word word may leave u dismay many time,0
crazy ar he married ü like gd looking guy frens like say he korean leonas fave dun thk aft thinking mayb prob ill go,0
two fundamental cool life walk like king walk like dont carewhoever king gud nyt,0
alrite sam nic checkin ur numberso ittb,0
imagine finally get sink bath put pace maybe even eat left also imagine feel cage cock surrounded bath water reminding always owns enjoy cuck,0
bill 3 £3365 thats bad,0
waiting e car 4 mum lor u leh reach home already,0
oh yes like torture watching england,0
leaving qatar tonite search opportunityall went fastpls add ur prayer dearrakhesh,0
u switch fone dammit,0
loan purpose even bad credit tenant welcome call noworriesloanscom 08717111821,1
mean left early check co im working 96,0
sorry brah finished last exam,0
thanx lot,0
sort code acc bank natwest reply confirm ive sent right person,0
haha awesome omw back,0
hey look like wrong one kappa guy number still phone want text see he around,0
driving training,0
mm feeling sleepy today shall get dear,0
love isnt decision feeling could decide love life would much simpler less magical,0
planning usually stop find hella weed smoke hella weed,0
got take 2 take part wrc rally oz u lucozade energy text rally le 61200 25p see pack lucozadecoukwrc itcould u,1
got divorce lol shes,0
im meeting darren,0
send ur birthdate month year tel u ur life partner name method calculation reply must,0
7 go ok na,0
s8 min go lunch,0
meet soon princess ttyl,0
great safe trip dont panic surrender,0
talk atleast day otherwise miss best friend world shakespeare shesil ltgt,0
midnight earliest,0
havent mu ask u 1st wat meet 4 lunch den u n meet already lor u wan 2 go ask da ge 1st confirm w asap,0
nope since ayo travelled forgotten guy,0
curious cuz asked,0
boo babe u enjoyin yourjob u seemed 2 b gettin well hunnyhope ure oktake care illspeak 2u soonlots loveme xxxx,0
lov line hurt truth dont mindi wil toleratbcs ur someone never comfort lie gud ni8 sweet dream,0
hi u decide wot 2 get 4 bday ill prob jus get voucher frm virgin sumfing,0
hi chikku send nice msg,0
yet chikkuwat abt u,0
u ask darren go n pick u lor oso sian tmr haf 2 meet lect,0
coming friday leave pongaldo get news work place,0
ill get 3 unless guy want come time sooner,0
sorry da gone mad many pending work,0
sent email – address incomm right,0
nicenicehow working,0
dont go tell friend youre sure want live smoke much spend hour begging come smoke,0
love daddy make scream pleasure going slap as dick,0
romantic paris 2 night 2 flight £79 book 4 next year call 08704439680tscs apply,1
way school pls send ashleys number,0
never blame day ur life good day give u happiness bad day give u experience essential life god blessing good morning,0
sorry ill call later,0
win £200 shopping spree every week starting 2 play text store 88039 skilgme tscs08714740323 1winawk age16 £150perweeksub,1
sound good finger make difficult type,0
sister cleared two round birla soft yesterday,0
dude go sup,0
yes baby need stretch open pussy,0
dont use hook,0
aight fuck ill get later,0
ey calm downon theacusations itxt u co iwana know wotu r doin thewend haventcn u agesring ur up4 nething satlove j xxx,0
congrats 1 year special cinema pas 2 call 09061209465 c suprman v matrix3 starwars3 etc 4 free bx420ip45we 150pm dont miss,1
tiime dont let hug dont break tear,0
probably im almost gas get cash tomorrow,0
fetch yun u fetch,0
ard 530 like dat lor juz meet mrt station ü dun haf come,0
ya well fine bbdpooja full pimpleseven become quite blackand ur rite cold wearing sweatter,0
usually take fifteen fucking minute respond yes question,0
good morning plz call sir,0
one day crab running sea shorethe wave came n cleared footprint crab crab asked frnd r u clearing beautiful footprint wave replied fox following ur footprint catch thats cleared frndsship never let u dwn gud nyt,0
sorry ill call later,0
outside office take,0
two carton u pleased shelf,0
dude like buff wind,0
try neva mate,0
oh charge camera,0
keep seeing weird shit bein woah realising actually reasonable im oh,0
yup song bro creative neva test quality said check review online,0
sleepingand surfing,0
remains bro amongst bros,0
free 1st week no1 nokia tone 4 ur mobile every week txt nokia 8077 get txting tell ur mate wwwgetzedcouk pobox 36504 w45wq 16 norm150ptone,1
urgent trying contact u today draw show £800 prize guaranteed call 09050001295 land line claim a21 valid 12hrs,1
im love im excited day spend make happy,0
dropped em omw back,0
wnt buy bmw car urgentlyits vry urgentbut hv shortage ltgt lacsthere source arng dis amt ltgt lacsthats prob,0
ok sweet dream,0
also ive sorta blown couple time recently id rather text blue looking weed,0
